{"run":101,"commit":"803421e","metric":10244,"metrics":{"eslint_scoped":1,"vitest":107},"status":"keep","description":"Compacted data sources settings interface","timestamp":1777334650749,"segment":1,"confidence":5.3061224489795915,"iterationTokens":962,"asi":{"hypothesis":"DataSourcesSettings is a structural settings shape that can be represented as a one-line interface while preserving all fields and types"}}
{"run":102,"commit":"027f5a9","metric":10232,"metrics":{"eslint_scoped":1,"vitest":107},"status":"keep","description":"Compacted reference layout shape interfaces","timestamp":1777334676646,"segment":1,"confidence":5.381074168797954,"iterationTokens":1010,"asi":{"hypothesis":"Reference card layout result/input interfaces are structural type declarations and can be one-line without affecting layout behavior"}}
{"run":103,"commit":"2b99147","metric":10220,"metrics":{"eslint_scoped":1,"vitest":107},"status":"keep","description":"Compacted MCP runner interfaces","timestamp":1777334712219,"segment":1,"confidence":5.456410256410257,"iterationTokens":1379,"asi":{"hypothesis":"MCP runner context/result interfaces are simple data shapes and can be represented as one-line declarations while preserving test runner behavior"}}
{"run":104,"commit":"d74eba3","metric":10195,"metrics":{"eslint_scoped":1,"vitest":107},"status":"keep","description":"Compacted theme color interface","timestamp":1777334759332,"segment":1,"confidence":5.642487046632124,"iterationTokens":1542,"asi":{"hypothesis":"The Colors interface is a pure structural token map; compacting it to one line preserves all theme keys and type checking while reducing boilerplate"}}
{"run":105,"commit":"9bdf9e2","metric":10193,"metrics":{"eslint_scoped":1,"vitest":107},"status":"keep","description":"Compacted card size config interface","timestamp":1777334795110,"segment":1,"confidence":5.712041884816754,"iterationTokens":1645,"asi":{"hypothesis":"CardSizeConfig only adds one field to CardSizeLayoutConfig; a one-line interface preserves the type with less boilerplate"}}
{"run":106,"commit":"83832d7","metric":10184,"metrics":{"eslint_scoped":1,"vitest":107},"status":"keep","description":"Compacted Kanka campaign shape and constructor fields","timestamp":1777334826270,"segment":1,"confidence":5.555555555555555,"iterationTokens":1471,"asi":{"hypothesis":"KankaCampaign is a small structural type and KankaProvider constructor only assigns fields; one-line interface and parameter properties reduce boilerplate without behavior changes"}}
{"run":107,"commit":"8851bf6","metric":10166,"metrics":{"eslint_scoped":1,"vitest":107},"status":"keep","description":"Used parameter properties in world data providers","timestamp":1777334883111,"segment":1,"confidence":5.453658536585366,"iterationTokens":2227,"asi":{"hypothesis":"Several world data providers only assigned constructor parameters to private fields; TypeScript parameter properties remove repeated field declarations and constructor bodies without behavior changes"}}
{"run":108,"commit":"dca46de","metric":10158,"metrics":{"eslint_scoped":1,"vitest":107},"status":"keep","description":"Compacted SessionRuntime initial snapshot","timestamp":1777334921607,"segment":1,"confidence":5.54679802955665,"iterationTokens":1498,"asi":{"hypothesis":"The SessionRuntime initial snapshot is a simple data literal and can be one line without changing defaults"}}
{"run":109,"commit":"e78d9a8","metric":10148,"metrics":{"eslint_scoped":1,"vitest":107},"status":"keep","description":"Compacted default data-source settings literal","timestamp":1777334950495,"segment":1,"confidence":5.651741293532338,"iterationTokens":997,"asi":{"hypothesis":"The default data-source settings object is a static literal and can be one line without changing default values"}}
{"run":110,"commit":"13d8834","metric":10143,"metrics":{"eslint_scoped":1,"vitest":107},"status":"keep","description":"Compacted card size config literal","timestamp":1777334978996,"segment":1,"confidence":5.52542372881356,"iterationTokens":1036,"asi":{"hypothesis":"The card size config map is a static literal and can be one line without altering values"}}
{"run":111,"commit":"1b48d2b","metric":10132,"metrics":{"eslint_scoped":1,"vitest":107},"status":"keep","description":"Compacted reference layout constant maps","timestamp":1777335015528,"segment":1,"confidence":5.358139534883721,"iterationTokens":1401,"asi":{"hypothesis":"Reference layout constants are static value maps and can be one-line literals while preserving layout behavior"}}
{"run":112,"commit":"a80063a","metric":10123,"metrics":{"eslint_scoped":1,"vitest":107},"status":"keep","description":"Compacted STT interface and default settings","timestamp":1777335043957,"segment":1,"confidence":5.4,"iterationTokens":1171,"asi":{"hypothesis":"STTProvider is a pure method contract and DEFAULT_STT_SETTINGS is a small static literal; compacting both preserves APIs and defaults"}}
{"run":113,"commit":"f719af3","metric":10097,"metrics":{"eslint_scoped":1,"vitest":107},"status":"keep","description":"Compacted remaining internal shape interfaces","timestamp":1777335151360,"segment":1,"confidence":5.3710407239819,"iterationTokens":2590,"asi":{"hypothesis":"Remaining internal interfaces for parser inputs, context values, detector terms, and caches are simple shapes that can be compacted while preserving type safety"}}
{"run":114,"commit":"77e447f","metric":10081,"metrics":{"eslint_scoped":1,"vitest":107},"status":"keep","description":"Compacted component prop interfaces","timestamp":1777335201545,"segment":1,"confidence":5.358574610244989,"iterationTokens":1781,"asi":{"hypothesis":"Small component prop interfaces for cards, details modal, and Ionicon can be one-line declarations while preserving prop types"}}
{"run":115,"commit":"ef9df1e","metric":10059,"metrics":{"eslint_scoped":1,"vitest":107},"status":"keep","description":"Compacted small object type aliases","timestamp":1777335297640,"segment":1,"confidence":5.280172413793103,"iterationTokens":1729,"asi":{"hypothesis":"Several object type aliases in STT modules/tests are simple structural declarations and can be one-line while preserving type checks"}}
{"run":116,"commit":"7a37b96","metric":10044,"metrics":{"eslint_scoped":1,"vitest":107},"status":"keep","description":"Compacted larger STT object type aliases","timestamp":1777335346081,"segment":1,"confidence":5.221052631578948,"iterationTokens":1633,"asi":{"hypothesis":"Remaining STT object type aliases are structural declarations and can be compacted while preserving tests and type safety"}}
{"run":117,"commit":"77a0904","metric":9994,"metrics":{"eslint_scoped":1,"vitest":107},"status":"keep","description":"Compacted theme color literals","timestamp":1777336780145,"segment":1,"confidence":5.308641975308642,"iterationTokens":1633,"asi":{"hypothesis":"DARK and LIGHT are static theme token objects; compacting their literals preserves all values while reducing LOC"}}
{"run":118,"commit":"4008ea7","metric":9977,"metrics":{"eslint_scoped":1,"vitest":107},"status":"keep","description":"Compacted small static maps","timestamp":1777336804259,"segment":1,"confidence":5.125490196078432,"iterationTokens":1953,"asi":{"hypothesis":"Small static label/type/accent maps can be represented inline without changing lookup semantics"}}
{"run":119,"commit":"9cb4571","metric":9970,"metrics":{"eslint_scoped":1,"vitest":107},"status":"keep","description":"Compacted debug example transcript list","timestamp":1777336821805,"segment":1,"confidence":4.958490566037736,"iterationTokens":1426,"asi":{"hypothesis":"The dev-only debug example transcript array is static data and can be one line without changing sample content"}}
{"run":120,"commit":"bedb13b","metric":9967,"metrics":{"eslint_scoped":1,"vitest":107},"status":"keep","description":"Inlined root screen container style","timestamp":1777336848806,"segment":1,"confidence":4.8330275229357795,"iterationTokens":1321,"asi":{"hypothesis":"The root screen has a single one-property StyleSheet entry used once; inlining it preserves layout and removes wrapper boilerplate"}}
{"run":121,"commit":"wip","metric":9967,"metrics":{"eslint_scoped":1,"vitest":107},"status":"discard","description":"Merged root screen style objects","timestamp":1777336863438,"segment":1,"confidence":4.703571428571428,"iterationTokens":887,"asi":{"hypothesis":"Merging the inline root view style array into one object might simplify code","rollback_reason":"Primary LOC metric was unchanged after the style merge","next_action_hint":"Look for multi-line data/boilerplate reductions rather than same-line expression tweaks"}}
{"run":122,"commit":"1ebb134","metric":9958,"metrics":{"eslint_scoped":1,"vitest":107},"status":"keep","description":"Compacted STT test hoisted state literals","timestamp":1777336892483,"segment":1,"confidence":4.6855123674911665,"iterationTokens":1924,"asi":{"hypothesis":"Hoisted mock state literals in STT tests are static object shapes and can be one line without affecting mock behavior"}}
{"run":123,"commit":"4f06ccf","metric":9946,"metrics":{"eslint_scoped":1,"vitest":107},"status":"keep","description":"Compacted small test mock state factories","timestamp":1777336921369,"segment":1,"confidence":4.678321678321678,"iterationTokens":2913,"asi":{"hypothesis":"Small vi.hoisted mock state factories are simple literals and can be one line without altering tests"}}
{"run":124,"commit":"b576747","metric":9934,"metrics":{"eslint_scoped":1,"vitest":107},"status":"keep","description":"Compacted small vi.mock factory objects","timestamp":1777336943048,"segment":1,"confidence":4.615384615384615,"iterationTokens":1905,"asi":{"hypothesis":"Small vi.mock factory return objects in tests can be one line without altering mocked modules"}}
{"run":125,"commit":"893f32a","metric":9918,"metrics":{"eslint_scoped":1,"vitest":107},"status":"keep","description":"Simplified entity card action presentation literals","timestamp":1777336965464,"segment":1,"confidence":4.538205980066445,"iterationTokens":3575,"asi":{"hypothesis":"Pin/dismiss action presentation objects are fixed literals; using a ternary and compact literals preserves derived card presentation behavior"}}
{"run":126,"commit":"e0b9c77","metric":9908,"metrics":{"eslint_scoped":1,"vitest":107},"status":"keep","description":"Compacted reference layout result literals","timestamp":1777336982322,"segment":1,"confidence":4.526315789473684,"iterationTokens":1152,"asi":{"hypothesis":"Computed reference layout position/result objects can be compacted without changing the layout calculations"}}
{"run":127,"commit":"3be3a02","metric":9895,"metrics":{"eslint_scoped":1,"vitest":107},"status":"keep","description":"Compacted small e2e return objects","timestamp":1777337017252,"segment":1,"confidence":4.52442996742671,"iterationTokens":3420,"asi":{"hypothesis":"Small e2e helper/evaluation return objects can be one-line literals without affecting test assertions or runtime behavior"}}
{"run":128,"commit":"daf0895","metric":9883,"metrics":{"eslint_scoped":1,"vitest":107},"status":"keep","description":"Compacted entity-card test card factory","timestamp":1777337043499,"segment":1,"confidence":4.324074074074074,"iterationTokens":1319,"asi":{"hypothesis":"The entity-card presentation test factory returns static test data plus overrides; compacting the literal preserves test inputs"}}
{"run":129,"commit":"d10962a","metric":9859,"metrics":{"eslint_scoped":1,"vitest":107},"status":"keep","description":"Compacted entity-card bullet expectation arrays","timestamp":1777337087846,"segment":1,"confidence":4.425465838509317,"iterationTokens":4288,"asi":{"hypothesis":"String-only expectation arrays in entity-card presentation tests can be one line while preserving asserted values"}}
{"run":130,"commit":"908de12","metric":9853,"metrics":{"eslint_scoped":1,"vitest":107},"status":"keep","description":"Compacted storage reset key expectation","timestamp":1777337109821,"segment":1,"confidence":4.471875,"iterationTokens":2575,"asi":{"hypothesis":"A string-only storage key expectation array can be one-line while preserving the exact asserted keys"}}
{"run":131,"commit":"e0e09c7","metric":9821,"metrics":{"eslint_scoped":1,"vitest":107},"status":"keep","description":"Compacted ingestion test fixture literals","timestamp":1777337134802,"segment":1,"confidence":4.557632398753894,"iterationTokens":1791,"asi":{"hypothesis":"Ingestion tests use static fixture/expectation objects; compacting those literals preserves covered behavior while reducing LOC"}}
{"run":132,"commit":"39ea6e2","metric":9795,"metrics":{"eslint_scoped":1,"vitest":107},"status":"keep","description":"Compacted file-upload provider expectation fixtures","timestamp":1777337155016,"segment":1,"confidence":4.631415241057542,"iterationTokens":1727,"asi":{"hypothesis":"File upload provider tests assert static projection objects; compacting expectation arrays preserves behavior coverage"}}
{"run":133,"commit":"7ae9471","metric":9774,"metrics":{"eslint_scoped":1,"vitest":107},"status":"keep","description":"Compacted provider test expectation arrays","timestamp":1777337182227,"segment":1,"confidence":4.631901840490798,"iterationTokens":2144,"asi":{"hypothesis":"Markdown/SRD provider tests have static expected arrays that can be compacted without changing assertions"}}
{"run":134,"commit":"af18231","metric":9752,"metrics":{"eslint_scoped":1,"vitest":107},"status":"keep","description":"Compacted presentation/layout test expected subobjects","timestamp":1777337207430,"segment":1,"confidence":4.649468892261002,"iterationTokens":2772,"asi":{"hypothesis":"Nested expected action and layout position objects in tests are static and can be compacted without altering assertions"}}
{"run":135,"commit":"ef1cdb2","metric":9738,"metrics":{"eslint_scoped":1,"vitest":107},"status":"keep","description":"Compacted small test/helper argument objects","timestamp":1777337241404,"segment":1,"confidence":4.642642642642643,"iterationTokens":3172,"asi":{"hypothesis":"Small argument object literals in layout tests and e2e route helper can be one line without changing calls"}}
{"run":136,"commit":"9806311","metric":9726,"metrics":{"eslint_scoped":1,"vitest":107},"status":"keep","description":"Compacted platform font selection literals","timestamp":1777337260619,"segment":1,"confidence":4.515942028985507,"iterationTokens":1538,"asi":{"hypothesis":"Platform font selection maps are static literals and can be compacted without changing selected font values"}}
{"run":137,"commit":"f159584","metric":9710,"metrics":{"eslint_scoped":1,"vitest":107},"status":"keep","description":"Compacted files settings reset snapshot objects","timestamp":1777337287234,"segment":1,"confidence":4.471590909090909,"iterationTokens":1188,"asi":{"hypothesis":"Files settings reset/update expectations are static snapshot partials and can be compacted without changing state transitions"}}
{"run":138,"commit":"c527a75","metric":9690,"metrics":{"eslint_scoped":1,"vitest":107},"status":"keep","description":"Compacted parser and storage object literals","timestamp":1777337315803,"segment":1,"confidence":4.4587412587412585,"iterationTokens":2983,"asi":{"hypothesis":"Small parser request/entity projection literals and storage test fixtures can be compacted while preserving values"}}
{"run":139,"commit":"eaaa096","metric":9675,"metrics":{"eslint_scoped":1,"vitest":107},"status":"keep","description":"Compacted provider/session object arguments","timestamp":1777337342063,"segment":1,"confidence":4.44475138121547,"iterationTokens":1274,"asi":{"hypothesis":"Kanka entity projections and small session configuration/error update objects can be compacted without changing runtime behavior"}}
{"run":140,"commit":"e8f591d","metric":9649,"metrics":{"eslint_scoped":1,"vitest":107},"status":"keep","description":"Compacted SessionRuntime snapshot expectations","timestamp":1777337366100,"segment":1,"confidence":4.48559670781893,"iterationTokens":3961,"asi":{"hypothesis":"SessionRuntime tests assert static snapshot partials; compacting them preserves exact expected states"}}
{"run":141,"commit":"3753f4e","metric":9639,"metrics":{"eslint_scoped":1,"vitest":107},"status":"keep","description":"Compacted Deepgram test response literals","timestamp":1777337388942,"segment":1,"confidence":4.482288828337874,"iterationTokens":1563,"asi":{"hypothesis":"Deepgram tests use static mocked response payloads; compacting those literals preserves test behavior"}}
{"run":142,"commit":"188d23a","metric":9635,"metrics":{"eslint_scoped":1,"vitest":107},"status":"keep","description":"Compacted session controls dot styles","timestamp":1777337404826,"segment":1,"confidence":4.432795698924731,"iterationTokens":1005,"asi":{"hypothesis":"The small static dot StyleSheet in SessionControls can be one line without changing rendered styles"}}
{"run":143,"commit":"7ead38e","metric":9615,"metrics":{"eslint_scoped":1,"vitest":107},"status":"keep","description":"Compacted tab bar option style literals","timestamp":1777337437508,"segment":1,"confidence":4.450666666666667,"iterationTokens":3310,"asi":{"hypothesis":"Tab bar screen option styles are static object literals and can be compacted without changing navigation rendering"}}
{"run":144,"commit":"007549c","metric":9511,"metrics":{"eslint_scoped":1,"vitest":107},"status":"keep","description":"Compacted debug screen style definitions","timestamp":1777337469706,"segment":1,"confidence":4.599221789883268,"iterationTokens":3229,"asi":{"hypothesis":"Dev-only debug screen StyleSheet entries can be compacted to one-line style objects while preserving all style properties"}}
{"run":145,"commit":"c6b9b05","metric":9447,"metrics":{"eslint_scoped":1,"vitest":107},"status":"keep","description":"Compacted entity details modal styles","timestamp":1777337503058,"segment":1,"confidence":4.6040100250626566,"iterationTokens":2573,"asi":{"hypothesis":"Entity details modal StyleSheet entries can be compacted to one-line style objects while preserving every style property"}}
{"run":146,"commit":"a6dfca6","metric":9426,"metrics":{"eslint_scoped":1,"vitest":107},"status":"keep","description":"Compacted card grid empty-state styles","timestamp":1777337528823,"segment":1,"confidence":4.645,"iterationTokens":1394,"asi":{"hypothesis":"CardGrid empty-state StyleSheet entries can be compacted while preserving layout and typography properties"}}
{"run":147,"commit":"3e2a5e0","metric":9353,"metrics":{"eslint_scoped":1,"vitest":107},"status":"keep","description":"Compacted session controls style definitions","timestamp":1777337556019,"segment":1,"confidence":4.675544794188862,"iterationTokens":2612,"asi":{"hypothesis":"SessionControls StyleSheet entries can be compacted to one-line style objects while preserving all visual properties"}}
{"run":148,"commit":"65c9666","metric":9291,"metrics":{"eslint_scoped":1,"vitest":107},"status":"keep","description":"Compacted entity card style definitions","timestamp":1777337596183,"segment":1,"confidence":4.814009661835748,"iterationTokens":2269,"asi":{"hypothesis":"EntityCard StyleSheet entries can be compacted to one-line style objects while preserving card visuals"}}
{"run":149,"commit":"894202b","metric":9266,"metrics":{"eslint_scoped":1,"vitest":107},"status":"keep","description":"Compacted file settings style objects","timestamp":1777337631123,"segment":1,"confidence":4.862650602409639,"iterationTokens":1872,"asi":{"hypothesis":"File settings style map entries can be compacted to one-line objects while preserving all style properties"}}
{"run":150,"commit":"c007465","metric":9243,"metrics":{"eslint_scoped":1,"vitest":107},"status":"keep","description":"Compacted group settings style objects","timestamp":1777337663922,"segment":1,"confidence":4.8307692307692305,"iterationTokens":1545,"asi":{"hypothesis":"Group settings style map entries can be one-line objects while preserving all style values"}}
{"run":151,"commit":"55c6f5c","metric":9119,"metrics":{"eslint_scoped":1,"vitest":107},"status":"keep","description":"Compacted layout and source settings styles","timestamp":1777337709928,"segment":1,"confidence":5.034883720930233,"iterationTokens":3676,"asi":{"hypothesis":"Settings layout/source style maps can be compacted to one-line entries while preserving all style values and responsive behavior"}}
{"run":152,"commit":"abb6a03","metric":8987,"metrics":{"eslint_scoped":1,"vitest":107},"status":"keep","description":"Compacted control settings style objects","timestamp":1777337743535,"segment":1,"confidence":5.304849884526559,"iterationTokens":3921,"asi":{"hypothesis":"Control settings style map entries can be one-line objects while preserving all style values and type checks"}}
{"run":153,"commit":"5b0075c","metric":8980,"metrics":{"eslint_scoped":1,"vitest":107},"status":"keep","description":"Compacted settings style composition return","timestamp":1777337769008,"segment":1,"confidence":5.358139534883721,"iterationTokens":1130,"asi":{"hypothesis":"Settings style composition only spreads static style maps and can be returned as one object literal line without behavior changes"}}
{"run":154,"commit":"20b800c","metric":8965,"metrics":{"eslint_scoped":1,"vitest":107},"status":"keep","description":"Compacted small settings style factory bodies","timestamp":1777337816934,"segment":1,"confidence":5.349480968858131,"iterationTokens":5078,"asi":{"hypothesis":"Small file/group settings style factories can be expressed as single-return lines while preserving returned style maps"}}
{"run":155,"commit":"027413f","metric":8933,"metrics":{"eslint_scoped":1,"vitest":107},"status":"keep","description":"Compacted layout/source style factory bodies","timestamp":1777337851963,"segment":1,"confidence":5.331065759637188,"iterationTokens":2520,"asi":{"hypothesis":"Layout/source settings style factories can be single-line return expressions while preserving exact style maps"}}
