{"run":196,"commit":"9c72070","metric":10530,"metrics":{"loc":10530,"vitest":107,"eslint_scoped":1},"status":"keep","description":"Removed unused platform and runtime type exports","timestamp":1777340587837,"segment":2,"confidence":62.71641791044776,"iterationTokens":3629,"asi":{"hypothesis":"ts-prune and repository search showed an unused platform helper file plus stale exported constants/types no longer referenced; deleting these dead exports reduces maintained code without behavior changes","metric_note":"Metric command printed a wc warning for deleted src/utils/platform.ts before staging, but effective post-delete formatted LOC was 10530 and all gates passed"}}
{"run":197,"commit":"2a0f36b","metric":10527,"metrics":{"loc":10527,"vitest":107,"eslint_scoped":1},"status":"keep","description":"Trimmed unused app-data barrel exports","timestamp":1777340617152,"segment":2,"confidence":52.6,"iterationTokens":3438,"asi":{"hypothesis":"The app-data barrel re-exported low-level helpers that are only used internally from app-data-core; removing unused public re-exports reduces API surface while preserving direct internal imports and tests"}}
{"run":198,"commit":"cc3d0ca","metric":10505,"metrics":{"loc":10505,"vitest":107,"eslint_scoped":1},"status":"keep","description":"Removed stale provider utility JSDoc","timestamp":1777340650932,"segment":2,"confidence":50.61904761904762,"iterationTokens":2100,"asi":{"hypothesis":"After deleting unused provider helpers, src/utils/providers.ts retained verbose historical JSDoc for small self-describing helpers; removing redundant comments reduces maintained LOC without obscuring behavior"}}
{"run":199,"commit":"7d5a988","metric":10478,"metrics":{"loc":10478,"vitest":107,"eslint_scoped":1},"status":"keep","description":"Simplified world provider names to properties","timestamp":1777340693659,"segment":2,"confidence":48.93181818181818,"iterationTokens":4732,"asi":{"hypothesis":"Every WorldDataProvider exposed a name through a trivial getName method; making name the interface member removes boilerplate methods across providers while preserving session error labels"}}
{"run":200,"commit":"3d9e694","metric":10438,"metrics":{"loc":10438,"vitest":107,"eslint_scoped":1},"status":"keep","description":"Collapsed settings style modules","timestamp":1777340779720,"segment":2,"confidence":49.84090909090909,"iterationTokens":13468,"asi":{"hypothesis":"The settings styles were split across five tiny modules used only by the styles barrel; merging them into the single createStyles module removes import/function/file boilerplate without changing generated styles","metric_note":"Metric command printed wc warnings for deleted style files before staging, but effective post-merge formatted LOC was 10438 and all gates passed"}}
{"run":201,"commit":"0fdbc3f","metric":10437,"metrics":{"loc":10437,"vitest":107,"eslint_scoped":1},"status":"keep","description":"Removed trivial session helper barrel","timestamp":1777340831271,"segment":2,"confidence":49.86363636363637,"iterationTokens":2343,"asi":{"hypothesis":"session-helpers.ts only re-exported STT builder helpers and one constant for a single consumer; inlining the interval constant and importing directly removes a pointless module","metric_note":"Metric command printed a wc warning for deleted src/context/session-helpers.ts before staging, but effective post-delete formatted LOC was 10437 and all gates passed"}}
{"run":202,"commit":"2994bfc","metric":10424,"metrics":{"loc":10424,"vitest":107,"eslint_scoped":1},"status":"keep","description":"Merged SessionRuntime type split back into runtime","timestamp":1777340882267,"segment":2,"confidence":47.46236559139785,"iterationTokens":3715,"asi":{"hypothesis":"After other reductions and using print-width 120, SessionRuntime can stay under the max-lines gate without a separate type-only module; merging the split removes file/import/re-export overhead while preserving exported public types","metric_note":"Metric command printed a wc warning for deleted src/context/session-runtime-types.ts before staging, but effective post-merge formatted LOC was 10424 and all gates passed"}}
{"run":203,"commit":"88581fa","metric":10415,"metrics":{"loc":10415,"vitest":107,"eslint_scoped":1},"status":"keep","description":"Inlined native audio adapter helpers","timestamp":1777340928610,"segment":2,"confidence":45.224489795918366,"iterationTokens":3692,"asi":{"hypothesis":"native-audio.ts was a tiny single-consumer wrapper used only by DeepgramNativeCaptureAdapter; inlining it removes module/export/import overhead while preserving native recorder behavior","metric_note":"Metric command printed a wc warning for deleted src/stt/native-audio.ts before staging, but effective post-inline formatted LOC was 10415 and all gates passed"}}
{"run":204,"commit":"1960c89","metric":10414,"metrics":{"loc":10414,"vitest":107,"eslint_scoped":1},"status":"keep","description":"Removed unused expo-status-bar dependency","timestamp":1777340958018,"segment":2,"confidence":44.34,"iterationTokens":2926,"asi":{"hypothesis":"knip and repository search showed expo-status-bar is declared but unused; removing the dependency trims package metadata and install surface without behavior changes","note":"package-lock changed via npm uninstall but package-lock is excluded from the LOC metric by design"}}
{"run":205,"commit":"04e1644","metric":10410,"metrics":{"loc":10410,"vitest":107,"eslint_scoped":1},"status":"keep","description":"Deleted unused E2E constants file","timestamp":1777341004947,"segment":2,"confidence":44.42,"iterationTokens":2223,"asi":{"hypothesis":"e2e/constants.ts defined wait constants that were not imported anywhere; deleting the unused test support file removes dead code without affecting current e2e specs or app behavior","metric_note":"Metric command printed a wc warning for deleted e2e/constants.ts before staging, but effective post-delete formatted LOC was 10410 and all gates passed"}}
{"run":206,"commit":"22cacdb","metric":10403,"metrics":{"loc":10403,"vitest":107,"eslint_scoped":1},"status":"keep","description":"Trimmed more internal app-data re-exports","timestamp":1777341036854,"segment":2,"confidence":42.0377358490566,"iterationTokens":2855,"asi":{"hypothesis":"clearStoredAppData and waitForUploadedFileMutations are implementation details used inside app-data.ts, not external barrel API; removing their re-exports reduces public surface without changing internal behavior"}}
{"run":207,"commit":"3ce3f31","metric":10397,"metrics":{"loc":10397,"vitest":107,"eslint_scoped":1},"status":"keep","description":"Aliased upload storage functions directly","timestamp":1777341077884,"segment":2,"confidence":41.370370370370374,"iterationTokens":1712,"asi":{"hypothesis":"file-upload provider wrappers simply forwarded to storage functions while discarding unused boolean results; exporting aliases and allowing service callbacks to return ignored values removes boilerplate without behavior changes for callers"}}
{"run":208,"commit":"c4dbb4e","metric":10393,"metrics":{"loc":10393,"vitest":107,"eslint_scoped":1},"status":"keep","description":"Inlined STT provider selection predicate","timestamp":1777341105811,"segment":2,"confidence":36.99173553719008,"iterationTokens":1509,"asi":{"hypothesis":"shouldUseDeepgram was a tiny single-use predicate in build-provider; inlining it into createProviderFactory removes indirection while keeping the provider selection condition unchanged"}}
{"run":209,"commit":"53596c6","metric":10392,"metrics":{"loc":10392,"vitest":107,"eslint_scoped":1},"status":"keep","description":"Inlined STT provider factory","timestamp":1777341131145,"segment":2,"confidence":33.417910447761194,"iterationTokens":2145,"asi":{"hypothesis":"createProviderFactory was only used by buildProvider; inlining the factory lambda removes a helper and unused type import while keeping late-event-safe provider construction equivalent"}}
{"run":210,"commit":"832b291","metric":10386,"metrics":{"loc":10386,"vitest":107,"eslint_scoped":1},"status":"keep","description":"Inlined Deepgram adapter factory","timestamp":1777341155896,"segment":2,"confidence":32.302158273381295,"iterationTokens":1490,"asi":{"hypothesis":"DeepgramProvider's adapter factory was a single-use helper; inlining the platform adapter choice into the constructor removes indirection while preserving browser/native behavior"}}
{"run":211,"commit":"22232a5","metric":10378,"metrics":{"loc":10378,"vitest":107,"eslint_scoped":1},"status":"keep","description":"Used findLastIndex for card eviction","timestamp":1777341184113,"segment":2,"confidence":31.291666666666668,"iterationTokens":2252,"asi":{"hypothesis":"The custom rightmost-unpinned-card loop duplicated Array.findLastIndex semantics; using the built-in method removes a single-use helper while preserving eviction behavior"}}
{"run":212,"commit":"cd5b93b","metric":10375,"metrics":{"loc":10375,"vitest":107,"eslint_scoped":1},"status":"keep","description":"Inlined UI stored setting initializers","timestamp":1777341208567,"segment":2,"confidence":30.693877551020407,"iterationTokens":2525,"asi":{"hypothesis":"readStoredColorScheme and readStoredCardSize were trivial single-use wrappers around readStoredSetting; inlining them into the useState initializers removes boilerplate without changing synchronous web hydration behavior"}}
{"run":213,"commit":"177d0ec","metric":10371,"metrics":{"loc":10371,"vitest":107,"eslint_scoped":1},"status":"keep","description":"Inlined stored app-data key collection","timestamp":1777341229687,"segment":2,"confidence":30.133333333333333,"iterationTokens":1132,"asi":{"hypothesis":"getStoredAppDataKeys was only used by clearStoredAppData after its barrel export was removed; inlining the key collection keeps reset behavior the same and removes a redundant helper"}}
{"run":214,"commit":"c727820","metric":10365,"metrics":{"loc":10365,"vitest":107,"eslint_scoped":1},"status":"keep","description":"Inlined voice settings guards","timestamp":1777341259802,"segment":2,"confidence":29.62091503267974,"iterationTokens":2112,"asi":{"hypothesis":"The voice settings patch/provider guards were tiny single-use helpers; inlining their simple checks into normalization removes local boilerplate while preserving validation semantics"}}
{"run":215,"commit":"3e30d4b","metric":10364,"metrics":{"loc":10364,"vitest":107,"eslint_scoped":1},"status":"keep","description":"Inlined uploaded file factory","timestamp":1777341287373,"segment":2,"confidence":29.064102564102566,"iterationTokens":1782,"asi":{"hypothesis":"createUploadedFile was only used by addUploadedFile; inlining the object construction removes a helper while preserving generated upload IDs and content"}}
{"run":216,"commit":"wip","metric":10375,"metrics":{"loc":10375,"vitest":107,"eslint_scoped":1},"status":"discard","description":"Tried shared SettingsGroup across renderers","timestamp":1777341376053,"segment":2,"confidence":27.47878787878788,"iterationTokens":5916,"asi":{"hypothesis":"Settings renderers repeat group wrapper/label/description markup; a shared SettingsGroup component applied across all sections might offset component/import overhead","rollback_reason":"Formatted LOC increased from 10364 to 10375 even when applied broadly; component overhead and multiline props outweighed removed labels","next_action_hint":"Do not retry SettingsGroup unless a larger renderer restructuring removes more than just label wrappers"}}
{"run":217,"commit":"d903e6c","metric":10238,"metrics":{"loc":10238,"vitest":107,"eslint_scoped":1},"status":"keep","description":"Removed stale generated MCP report","timestamp":1777341415298,"segment":2,"confidence":27.50574712643678,"iterationTokens":2854,"asi":{"hypothesis":"e2e/mcp-test-report.md is a generated test artifact with stale run output and screenshots, not source behavior or documentation; deleting it removes generated noise from maintained LOC","metric_note":"Metric command printed a wc warning for deleted e2e/mcp-test-report.md before staging, but effective post-delete formatted LOC was 10238 and all gates passed"}}
{"run":218,"commit":"a40de21","metric":10234,"metrics":{"loc":10234,"vitest":107,"eslint_scoped":1},"status":"keep","description":"Simplified speech mock emit helpers","timestamp":1777341462329,"segment":2,"confidence":23.850746268656717,"iterationTokens":3076,"asi":{"hypothesis":"The Playwright speech mock emit helpers used block callbacks that only forwarded a single expression; expression callbacks remove unnecessary boilerplate while preserving evaluation behavior"}}
{"run":219,"commit":"0849049","metric":10230,"metrics":{"loc":10230,"vitest":107,"eslint_scoped":1},"status":"keep","description":"Inlined settings wait helper","timestamp":1777341500672,"segment":2,"confidence":23.53921568627451,"iterationTokens":1538,"asi":{"hypothesis":"waitForSettings was only called by gotoSettings in e2e helpers; inlining the load/selector waits removes an unused exported helper while preserving settings navigation behavior"}}
{"run":220,"commit":"bedd5bc","metric":10222,"metrics":{"loc":10222,"vitest":107,"eslint_scoped":1},"status":"keep","description":"Inlined setup-only E2E route helpers","timestamp":1777341530189,"segment":2,"confidence":22.409302325581397,"iterationTokens":2092,"asi":{"hypothesis":"interceptFonts and interceptExternalApis were only used by setupTest; inlining their routes into setupTest removes helper/constant boilerplate while preserving the same Playwright network setup"}}
{"run":221,"commit":"cdda00f","metric":10215,"metrics":{"loc":10215,"vitest":107,"eslint_scoped":1},"status":"keep","description":"Looped simple screenshot specs","timestamp":1777341574023,"segment":2,"confidence":21.571428571428573,"iterationTokens":3386,"asi":{"hypothesis":"Several screenshot tests differed only by name, route, and screenshot path; table-driven tests remove duplication while preserving the same screenshots and routes"}}
{"run":222,"commit":"cdced3d","metric":10201,"metrics":{"loc":10201,"vitest":107,"eslint_scoped":1},"status":"keep","description":"Removed redundant screenshot test comments","timestamp":1777341608299,"segment":2,"confidence":21.409691629955947,"iterationTokens":1899,"asi":{"hypothesis":"The screenshot specs had step comments that merely repeated the following Playwright actions; deleting redundant comments reduces maintained LOC without reducing useful documentation"}}
{"run":223,"commit":"cfbd9d5","metric":10194,"metrics":{"loc":10194,"vitest":107,"eslint_scoped":1},"status":"keep","description":"Removed redundant E2E debug comments","timestamp":1777341639840,"segment":2,"confidence":20.82905982905983,"iterationTokens":964,"asi":{"hypothesis":"The standalone e2e debug script had comments that simply narrated each immediately following locator/screenshot action; removing them reduces noise without changing the diagnostic script"}}
{"run":224,"commit":"8f37387","metric":10128,"metrics":{"loc":10128,"vitest":107,"eslint_scoped":1},"status":"keep","description":"Deleted unreferenced E2E debug script","timestamp":1777341666387,"segment":2,"confidence":19.865079365079364,"iterationTokens":1068,"asi":{"hypothesis":"e2e/debug.ts was an unreferenced standalone screenshot/debug script with no package or Justfile entry; deleting it removes dead developer tooling code while leaving the actual Playwright specs and app debug tab intact","metric_note":"Metric command printed a wc warning for deleted e2e/debug.ts before staging, but effective post-delete formatted LOC was 10128 and all gates passed"}}
{"run":225,"commit":"b5c7ab4","metric":10125,"metrics":{"loc":10125,"vitest":107,"eslint_scoped":1},"status":"keep","description":"Inlined single-use ingestion constants","timestamp":1777341722047,"segment":2,"confidence":19.129770992366414,"iterationTokens":3325,"asi":{"hypothesis":"The upload JSON extension and upload ID prefix constants were each used once inside ingestion; inlining those literals removes unnecessary top-level names without changing parsing or ID generation"}}
{"run":226,"commit":"05e59dc","metric":10124,"metrics":{"loc":10124,"vitest":107,"eslint_scoped":1},"status":"keep","description":"Removed redundant Homebrewery ID comment","timestamp":1777341750168,"segment":2,"confidence":16.439344262295084,"iterationTokens":1540,"asi":{"hypothesis":"The Homebrewery fallback ID comment restated the immediately following trim/split fallback; removing it reduces noise without changing extraction behavior"}}
{"run":227,"commit":"720500d","metric":10122,"metrics":{"loc":10122,"vitest":107,"eslint_scoped":1},"status":"keep","description":"Collapsed empty SRD cache catch","timestamp":1777341786186,"segment":2,"confidence":17.184931506849313,"iterationTokens":1549,"asi":{"hypothesis":"The SRD cache save catch only intentionally ignored storage failures and had a redundant explanatory comment; using an empty catch keeps cache-failure behavior while reducing noise"}}
{"run":228,"commit":"27ce841","metric":10120,"metrics":{"loc":10120,"vitest":107,"eslint_scoped":1},"status":"keep","description":"Condensed card size config type","timestamp":1777341808107,"segment":2,"confidence":16.85234899328859,"iterationTokens":1048,"asi":{"hypothesis":"CardSizeConfig is a simple extension of CardSizeLayoutConfig with one field; an intersection type expresses the same contract with less boilerplate"}}
{"run":229,"commit":"d53f5cb","metric":10118,"metrics":{"loc":10118,"vitest":107,"eslint_scoped":1},"status":"keep","description":"Condensed styled section props type","timestamp":1777341835308,"segment":2,"confidence":16.532894736842106,"iterationTokens":1302,"asi":{"hypothesis":"StyledSectionProps only wrapped a single styles field for renderer prop interfaces; a one-line type alias preserves the shared contract with less boilerplate"}}
{"run":230,"commit":"10b6cd7","metric":10115,"metrics":{"loc":10115,"vitest":107,"eslint_scoped":1},"status":"keep","description":"Inlined card presentation constants","timestamp":1777341872977,"segment":2,"confidence":16.39087947882736,"iterationTokens":2139,"asi":{"hypothesis":"Entity card bullet marker and max summary bullet constants were local single-use values; inlining them removes exported module surface without changing presentation output"}}
{"run":231,"commit":"4f3eab0","metric":10108,"metrics":{"loc":10108,"vitest":107,"eslint_scoped":1},"status":"keep","description":"Inlined card action presentation types","timestamp":1777341901773,"segment":2,"confidence":16.598684210526315,"iterationTokens":1144,"asi":{"hypothesis":"EntityCardDismissActionPresentation and EntityCardActionsPresentation were only used to type a single nested property; inlining that nested shape removes unused exported types while preserving the presentation contract"}}
{"run":232,"commit":"20c2f36","metric":10104,"metrics":{"loc":10104,"vitest":107,"eslint_scoped":1},"status":"keep","description":"Inlined pin toggle literal aliases","timestamp":1777341927710,"segment":2,"confidence":15.79375,"iterationTokens":1123,"asi":{"hypothesis":"The pin toggle kind/icon/label aliases were only used inside EntityCardPinTogglePresentation; inlining the literal unions removes type indirection without changing call sites"}}
{"run":233,"commit":"d55d7d3","metric":10093,"metrics":{"loc":10093,"vitest":107,"eslint_scoped":1},"status":"keep","description":"Condensed simple layout shape types","timestamp":1777341968511,"segment":2,"confidence":14.842105263157896,"iterationTokens":2036,"asi":{"hypothesis":"Several reference-card layout interfaces were simple object shapes with one or two fields; one-line type aliases preserve type contracts with less boilerplate"}}
{"run":234,"commit":"5cb81d3","metric":10089,"metrics":{"loc":10089,"vitest":107,"eslint_scoped":1},"status":"keep","description":"Condensed CardState shape type","timestamp":1777341998029,"segment":2,"confidence":13.703504043126685,"iterationTokens":1312,"asi":{"hypothesis":"CardState is a small structural object type; a one-line type alias preserves the same shape while removing interface boilerplate"}}
{"run":235,"commit":"71c9f78","metric":10086,"metrics":{"loc":10086,"vitest":107,"eslint_scoped":1},"status":"keep","description":"Condensed world provider type","timestamp":1777342029825,"segment":2,"confidence":12.725,"iterationTokens":1375,"asi":{"hypothesis":"WorldDataProvider is a small structural contract with only name and load; a one-line type alias preserves implementation checking while reducing interface boilerplate"}}
{"run":236,"commit":"469ff00","metric":10085,"metrics":{"loc":10085,"vitest":107,"eslint_scoped":1},"status":"keep","description":"Removed unused MCP runner console error state","timestamp":1777342060014,"segment":2,"confidence":11.572727272727272,"iterationTokens":1616,"asi":{"hypothesis":"The MCP runner allocated consoleErrors but never populated it; replacing it with an empty failure errors array removes dead state without changing reported results"}}
{"run":237,"commit":"bdb8dcc","metric":10083,"metrics":{"loc":10083,"vitest":107,"eslint_scoped":1},"status":"keep","description":"Inlined MCP test arrays","timestamp":1777342098127,"segment":2,"confidence":10.751054852320674,"iterationTokens":4647,"asi":{"hypothesis":"MCP tests had small arrays stored in single-use constants immediately before iteration/filtering; inlining those arrays removes temporary names without changing tested sizes or tab labels"}}
{"run":238,"commit":"0746db0","metric":10078,"metrics":{"loc":10078,"vitest":107,"eslint_scoped":1},"status":"keep","description":"Condensed MCP test context type","timestamp":1777342130782,"segment":2,"confidence":10.772151898734178,"iterationTokens":1629,"asi":{"hypothesis":"The MCP TestContext is a small structural object shape; a one-line type alias removes interface boilerplate and an unused import while preserving test typing"}}
