{"type":"config","name":"Minimize project LOC by reducing repeated code and simplifying while preserving functionality","metricName":"loc","metricUnit":"","bestDirection":"lower"}
{"run":1,"commit":"091f546","metric":11330,"metrics":{},"status":"keep","description":"Baseline LOC excluding package-lock, with TypeScript check","timestamp":1777331225561,"segment":0,"confidence":null,"iterationTokens":179,"asi":{"hypothesis":"Establish baseline LOC metric and correctness gate before simplification experiments"}}
{"run":2,"commit":"5c6b53f","metric":11326,"metrics":{},"status":"keep","description":"Shared DataSection TextInput defaults via DataInput helper","timestamp":1777331254907,"segment":0,"confidence":null,"iterationTokens":12688,"asi":{"hypothesis":"Factoring repeated data-source TextInput props into one local helper reduces LOC while preserving settings behavior"}}
{"run":3,"commit":"wip","metric":11332,"metrics":{},"status":"discard","description":"Tried factoring SessionControls button markup, but helper/type overhead increased LOC","timestamp":1777331271985,"segment":0,"confidence":2,"iterationTokens":6015,"asi":{"hypothesis":"A shared ControlButton component could remove repeated TouchableOpacity/Text button markup","rollback_reason":"Helper imports and prop type declarations outweighed the removed JSX, increasing LOC from 11326 to 11332","next_action_hint":"Prefer larger repeated blocks or existing abstractions with no extra type overhead"}}
{"run":4,"commit":"d5e999b","metric":11289,"metrics":{},"status":"keep","description":"Consolidated repeated settings category navigation and FilesSection prop plumbing","timestamp":1777331311748,"segment":0,"confidence":13.666666666666666,"iterationTokens":13552,"asi":{"hypothesis":"Settings screen repeats desktop/mobile category button JSX and verbose FilesSection prop forwarding; local render helper and spread preserve behavior with fewer lines"}}
{"run":5,"commit":"bb60a6f","metric":11270,"metrics":{},"status":"keep","description":"Shared settings TextInput defaults across renderer sections","timestamp":1777331358611,"segment":0,"confidence":10,"iterationTokens":6659,"asi":{"hypothesis":"A reusable SettingsInput removes repeated placeholder color/autocorrect/autocapitalize/style props from data, voice, files, and AI settings inputs"}}
{"run":6,"commit":"wip","metric":11279,"metrics":{},"status":"discard","description":"Inlined SessionRuntime listener notification, but run exposed prior metric undercount from untracked new file","timestamp":1777331390621,"segment":0,"confidence":2.5531914893617023,"iterationTokens":4735,"asi":{"hypothesis":"Removing the separate notifyListeners method in SessionRuntime reduces code without behavior change","rollback_reason":"Although locally smaller, the active benchmark reported worse than logged best because the previous experiment added an untracked file that git ls-files did not count until commit","next_action_hint":"Reset the autoresearch metric command to include untracked source files, establish a corrected baseline, then retry this simplification"}}
{"type":"config","name":"Minimize project LOC with tracked-and-untracked source count, preserving functionality","metricName":"loc","metricUnit":"","bestDirection":"lower"}
{"run":7,"commit":"6f27835","metric":11284,"metrics":{},"status":"keep","description":"Corrected LOC baseline counting both tracked and untracked source files","timestamp":1777331402968,"segment":1,"confidence":null,"iterationTokens":180,"asi":{"hypothesis":"Use a non-cheatable LOC metric that includes new source files before commit as well as tracked files"}}
{"run":8,"commit":"78e69b9","metric":11279,"metrics":{},"status":"keep","description":"Inlined SessionRuntime listener notification","timestamp":1777331419004,"segment":1,"confidence":null,"iterationTokens":495,"asi":{"hypothesis":"Removing a single-use notifyListeners method simplifies SessionRuntime and reduces LOC while preserving subscription behavior"}}
{"run":9,"commit":"5bb21b1","metric":11267,"metrics":{},"status":"keep","description":"Consolidated JSON settings load/save error handling","timestamp":1777331452532,"segment":1,"confidence":3.4,"iterationTokens":4713,"asi":{"hypothesis":"Voice and data-source settings used duplicated JSON storage try/catch paths; generic load/save helpers reduce repetition while preserving normalization and warnings"}}
{"run":10,"commit":"7a8a677","metric":11265,"metrics":{},"status":"keep","description":"Simplified app data clear guard","timestamp":1777331462330,"segment":1,"confidence":2.7142857142857144,"iterationTokens":594,"asi":{"hypothesis":"A single-statement guard in clearStoredAppData keeps behavior identical while removing needless block noise"}}
{"run":11,"commit":"f10d466","metric":11253,"metrics":{},"status":"keep","description":"Collapsed simple single-statement guards","timestamp":1777331506195,"segment":1,"confidence":2.5833333333333335,"iterationTokens":3777,"asi":{"hypothesis":"Several trivial one-statement conditionals use block form; collapsing them reduces visual noise without changing behavior"}}
{"run":12,"commit":"d615569","metric":11243,"metrics":{},"status":"keep","description":"Collapsed more trivial guard clauses","timestamp":1777331535505,"segment":1,"confidence":3.1538461538461537,"iterationTokens":2442,"asi":{"hypothesis":"More single-statement guard blocks can be represented directly, reducing ceremony while preserving semantics"}}
{"run":13,"commit":"28e7e68","metric":11241,"metrics":{},"status":"keep","description":"Simplified uploaded-file shape validation","timestamp":1777331580324,"segment":1,"confidence":3.0714285714285716,"iterationTokens":5189,"asi":{"hypothesis":"Checking UploadedFile string fields with a small key list removes repeated typeof clauses without changing validation behavior"}}
{"run":14,"commit":"wip","metric":11248,"metrics":{},"status":"discard","description":"Tried extracting DisplaySection segment button, but prop/type overhead increased LOC","timestamp":1777331602585,"segment":1,"confidence":3.185185185185185,"iterationTokens":4034,"asi":{"hypothesis":"The repeated card-size/theme segment JSX could share a SegmentButton helper","rollback_reason":"The local helper and props type cost more lines than the duplicated JSX it replaced","next_action_hint":"Avoid extracting small JSX repeats unless helper can be reused across more sections or typed without local overhead"}}
{"run":15,"commit":"a2d8b66","metric":11237,"metrics":{},"status":"keep","description":"Simplified SRD publisher grouping construction","timestamp":1777331618217,"segment":1,"confidence":3.9166666666666665,"iterationTokens":1008,"asi":{"hypothesis":"The SRD source grouping setup can use a compact reduce expression instead of an IIFE with manual map initialization"}}
{"run":16,"commit":"edd4297","metric":11233,"metrics":{},"status":"keep","description":"Shared Web Speech permission/action error formatting","timestamp":1777331639264,"segment":1,"confidence":3.642857142857143,"iterationTokens":2430,"asi":{"hypothesis":"Restart and resume error handlers duplicate permission-vs-generic branching; a small formatter reduces repeated code while preserving messages"}}
{"run":17,"commit":"6d52ee0","metric":11232,"metrics":{},"status":"keep","description":"Simplified Web Speech restart timer cleanup guard","timestamp":1777331652392,"segment":1,"confidence":3.466666666666667,"iterationTokens":523,"asi":{"hypothesis":"Inverting the clearRestartTimer guard removes nesting and one line without behavior change"}}
{"run":18,"commit":"b571c6c","metric":11219,"metrics":{},"status":"keep","description":"Compacted trivial FakeSTTProvider test methods","timestamp":1777331673642,"segment":1,"confidence":5,"iterationTokens":3399,"asi":{"hypothesis":"The fake STT provider in SessionRuntime tests has tiny call-count methods that read clearly as one-liners and remove boilerplate"}}
{"run":19,"commit":"9c94452","metric":11194,"metrics":{"eslint_scoped":1},"status":"keep","description":"Compacted Deepgram browser test mock methods and fixed import ordering","timestamp":1777331720357,"segment":1,"confidence":8.181818181818182,"iterationTokens":2963,"asi":{"hypothesis":"Mock class methods that only mutate test counters/state can be concise one-liners, and scoped eslint verifies formatting for touched source areas"}}
{"run":20,"commit":"644b534","metric":11188,"metrics":{"eslint_scoped":1},"status":"keep","description":"Compacted Deepgram native test mock recorder methods","timestamp":1777331733354,"segment":1,"confidence":5.647058823529412,"iterationTokens":626,"asi":{"hypothesis":"The native recorder test double methods are simple enough to express as concise one-liners without changing test behavior"}}
{"run":21,"commit":"4f867a2","metric":11169,"metrics":{"eslint_scoped":1},"status":"keep","description":"Compacted more trivial STT test double methods","timestamp":1777331764363,"segment":1,"confidence":5.2272727272727275,"iterationTokens":3674,"asi":{"hypothesis":"Several STT test doubles have one-action methods that can be concise one-liners while remaining readable and lint-clean"}}
{"run":22,"commit":"2b0f71f","metric":11166,"metrics":{"eslint_scoped":1},"status":"keep","description":"Factored repeated settings section styles prop type","timestamp":1777331789313,"segment":1,"confidence":5.130434782608695,"iterationTokens":1103,"asi":{"hypothesis":"All settings section prop interfaces repeat the same styles field; a small base interface reduces repeated type declarations"}}
{"run":23,"commit":"88de0ec","metric":11161,"metrics":{"eslint_scoped":1},"status":"keep","description":"Compacted simple app-data storage test mocks","timestamp":1777331808552,"segment":1,"confidence":4.392857142857143,"iterationTokens":1016,"asi":{"hypothesis":"Storage mock callbacks in app-data tests are simple enough to keep on one line, reducing boilerplate while retaining the same mocked behavior"}}
{"run":24,"commit":"da9d644","metric":11143,"metrics":{"eslint_scoped":1},"status":"keep","description":"Collapsed simple callbacks in settings hooks and STT adapters","timestamp":1777331846984,"segment":1,"confidence":4.548387096774194,"iterationTokens":3231,"asi":{"hypothesis":"Several callbacks only forward one call; expressing them inline reduces repeated block ceremony while scoped lint and typecheck preserve correctness"}}
{"run":25,"commit":"b1c0f19","metric":11135,"metrics":{"eslint_scoped":1},"status":"keep","description":"Collapsed simple E2E speech mock forwarding callbacks","timestamp":1777331864565,"segment":1,"confidence":4.382352941176471,"iterationTokens":708,"asi":{"hypothesis":"E2E helper page-evaluate callbacks only forward into the speech mock, so one-line callbacks preserve behavior and reduce boilerplate"}}
{"run":26,"commit":"70b7de5","metric":11133,"metrics":{"eslint_scoped":1},"status":"keep","description":"Compacted settings save-timer cleanup callback","timestamp":1777331880407,"segment":1,"confidence":4.136986301369863,"iterationTokens":532,"asi":{"hypothesis":"The settings cleanup effect only contains a single guarded clearTimeout call, so a concise callback reduces ceremony without changing lifecycle behavior"}}
{"run":27,"commit":"62f56dd","metric":11103,"metrics":{"eslint_scoped":1},"status":"keep","description":"Collapsed session and Deepgram forwarding callbacks","timestamp":1777331918189,"segment":1,"confidence":4.7631578947368425,"iterationTokens":3937,"asi":{"hypothesis":"Session provider callbacks and Deepgram data/transcript forwarding callbacks are single-call wrappers that can be expressed inline to reduce repeated ceremony"}}
{"run":28,"commit":"d1ee54a","metric":11099,"metrics":{"eslint_scoped":1},"status":"keep","description":"Collapsed data-source callbacks and shared UI setting save warnings","timestamp":1777331949186,"segment":1,"confidence":4.567901234567901,"iterationTokens":4148,"asi":{"hypothesis":"Small context callbacks and duplicated UI preference save/catch blocks can be simplified without changing persistence behavior"}}
{"run":29,"commit":"wip","metric":11106,"metrics":{"eslint_scoped":1},"status":"discard","description":"Tried extracting EntityCard action icon helper, but helper overhead increased LOC","timestamp":1777331973255,"segment":1,"confidence":3.8541666666666665,"iterationTokens":1878,"asi":{"hypothesis":"The pin/dismiss action buttons in EntityCard could share an ActionIcon helper","rollback_reason":"The new helper and prop plumbing cost more lines than the duplicated action markup saved","next_action_hint":"Only extract EntityCard UI helpers if reused by details modal or other components too"}}
{"run":30,"commit":"af03f3f","metric":11097,"metrics":{"eslint_scoped":1},"status":"keep","description":"Shared synchronous web UI preference reader","timestamp":1777331998617,"segment":1,"confidence":4.065217391304348,"iterationTokens":1782,"asi":{"hypothesis":"Card size and color scheme localStorage readers are structurally identical; a typed readStoredSetting helper removes duplication and preserves hydration behavior"}}
{"run":31,"commit":"b87b23d","metric":11091,"metrics":{"eslint_scoped":1,"vitest":103},"status":"keep","description":"Shared detector instance in detector tests","timestamp":1777332026268,"segment":1,"confidence":3.574074074074074,"iterationTokens":2377,"asi":{"hypothesis":"EntityDetector tests repeatedly construct the same immutable detector; sharing one instance reduces setup repetition while full unit tests confirm behavior"}}
{"run":32,"commit":"5942f57","metric":11079,"metrics":{"eslint_scoped":1,"vitest":107},"status":"keep","description":"Parameterized simple slugify and entity-type tests","timestamp":1777332045124,"segment":1,"confidence":3.6283185840707963,"iterationTokens":1424,"asi":{"hypothesis":"Simple one-assertion utility tests are repetitive; parameterizing them preserves coverage and cuts duplicate test bodies"}}
{"run":33,"commit":"752a85a","metric":11077,"metrics":{"eslint_scoped":1,"vitest":107},"status":"keep","description":"Compacted empty-summary parameterized test body","timestamp":1777332069352,"segment":1,"confidence":3.7636363636363637,"iterationTokens":2185,"asi":{"hypothesis":"A parameterized test with a single assertion can be expressed directly as an expression body without reducing coverage"}}
{"run":34,"commit":"65bc655","metric":11071,"metrics":{"eslint_scoped":1,"vitest":107},"status":"keep","description":"Removed redundant Playwright beforeEach page annotations","timestamp":1777332136636,"segment":1,"confidence":3.1791044776119404,"iterationTokens":4461,"asi":{"hypothesis":"Playwright fixtures already infer the page type in beforeEach hooks; removing repeated inline annotations reduces test boilerplate while typecheck verifies inference"}}
{"run":35,"commit":"e55394a","metric":11059,"metrics":{"eslint_scoped":1,"vitest":107},"status":"keep","description":"Compacted repeated storage mock callbacks in provider/STT tests","timestamp":1777332170079,"segment":1,"confidence":3.2142857142857144,"iterationTokens":2415,"asi":{"hypothesis":"Several tests repeat tiny AsyncStorage mock callbacks and one-line cleanup hooks; compacting them reduces boilerplate while full unit tests pass"}}
{"run":36,"commit":"8ee2486","metric":11055,"metrics":{"eslint_scoped":1,"vitest":107},"status":"keep","description":"Compacted parameterized detector utility assertions","timestamp":1777332193627,"segment":1,"confidence":3.2714285714285714,"iterationTokens":2003,"asi":{"hypothesis":"Parameterized slugify/entity-type tests each contain a single assertion and can use expression bodies to reduce ceremony"}}
{"run":37,"commit":"7b8720e","metric":11045,"metrics":{"eslint_scoped":1,"vitest":107},"status":"keep","description":"Compacted simple cleanup and mutation callbacks in tests","timestamp":1777332220094,"segment":1,"confidence":3.3661971830985915,"iterationTokens":1218,"asi":{"hypothesis":"A handful of test cleanup and mutation callbacks are single actions; one-line forms remove boilerplate while full tests pass"}}
{"run":38,"commit":"ffde92f","metric":11027,"metrics":{"eslint_scoped":1,"vitest":107},"status":"keep","description":"Compacted remaining simple expression callbacks","timestamp":1777332273984,"segment":1,"confidence":3.5205479452054793,"iterationTokens":2350,"asi":{"hypothesis":"Remaining single-expression callbacks in debug, UI settings, and tests can be collapsed while lint/typecheck/tests preserve behavior"}}
{"run":39,"commit":"1f10a01","metric":11022,"metrics":{"eslint_scoped":1,"vitest":107},"status":"keep","description":"Removed unused settings renderers barrel","timestamp":1777332315589,"segment":1,"confidence":3.4473684210526314,"iterationTokens":2635,"asi":{"hypothesis":"The settings renderers index barrel was unused; deleting dead export plumbing reduces LOC without affecting imports or behavior"}}
{"run":40,"commit":"7db8dfb","metric":11020,"metrics":{"eslint_scoped":1,"vitest":107},"status":"keep","description":"Returned plain group style object without StyleSheet wrapper","timestamp":1777332338719,"segment":1,"confidence":3.279503105590062,"iterationTokens":1221,"asi":{"hypothesis":"Dynamic settings style factories do not need StyleSheet.create for the small group style map; returning the plain style object preserves React Native behavior and removes wrapper/import noise"}}
{"run":41,"commit":"wip","metric":11012,"metrics":{"eslint_scoped":0,"vitest":0},"status":"checks_failed","description":"Tried returning plain objects from all settings style factories, but type inference widened fontWeight","timestamp":1777332358803,"segment":1,"confidence":3.142857142857143,"iterationTokens":988,"asi":{"hypothesis":"All settings style factories could drop StyleSheet.create wrappers after groups succeeded","rollback_reason":"TypeScript widened plain object fontWeight values to string in larger style maps, breaking React Native StyleProp compatibility","next_action_hint":"Either keep StyleSheet.create for larger style maps or use `as const`/typed helpers if revisiting, but verify net LOC after type annotations"}}
{"run":42,"commit":"6ef0d12","metric":11018,"metrics":{"eslint_scoped":1,"vitest":107},"status":"keep","description":"Returned plain file style object without StyleSheet wrapper","timestamp":1777332383282,"segment":1,"confidence":3.2439024390243905,"iterationTokens":1446,"asi":{"hypothesis":"The file settings style map has no literal-sensitive fontWeight values, so it can safely drop StyleSheet.create and its import like group styles"}}
{"run":43,"commit":"762799e","metric":11012,"metrics":{"eslint_scoped":1,"vitest":107},"status":"keep","description":"Dropped remaining settings style StyleSheet wrappers with const inference","timestamp":1777332409089,"segment":1,"confidence":3.238095238095238,"iterationTokens":1494,"asi":{"hypothesis":"Larger settings style maps can also avoid StyleSheet.create if returned as const to preserve literal style value types, removing repeated imports/wrappers"}}
{"run":44,"commit":"f90fc28","metric":11004,"metrics":{"eslint_scoped":1,"vitest":107},"status":"keep","description":"Removed unused entity providers barrel","timestamp":1777332453404,"segment":1,"confidence":3.218390804597701,"iterationTokens":1124,"asi":{"hypothesis":"The entity providers index barrel had no imports anywhere in the app/tests, so deleting dead re-export plumbing preserves behavior and reduces LOC"}}
{"run":45,"commit":"add711d","metric":10992,"metrics":{"eslint_scoped":1,"vitest":107},"status":"keep","description":"Compacted short multi-line imports","timestamp":1777332497081,"segment":1,"confidence":3.3181818181818183,"iterationTokens":2025,"asi":{"hypothesis":"A few two-symbol imports were spread over four lines; one-line imports keep lint passing and reduce import boilerplate"}}
{"run":46,"commit":"afb1150","metric":10979,"metrics":{"eslint_scoped":1,"vitest":107},"status":"keep","description":"Reused setupTestWithSession in E2E specs","timestamp":1777332543582,"segment":1,"confidence":3.210526315789474,"iterationTokens":2415,"asi":{"hypothesis":"Several E2E specs repeated setupTest followed by startSession despite an existing setupTestWithSession helper; using it reduces repeated setup code"}}
{"run":47,"commit":"2b15afc","metric":10973,"metrics":{"eslint_scoped":1,"vitest":107},"status":"keep","description":"Compacted reference layout constant destructuring","timestamp":1777332580851,"segment":1,"confidence":3.616279069767442,"iterationTokens":3273,"asi":{"hypothesis":"The reference card layout function destructures a small constant object over many lines; a single-line destructure reduces ceremony without logic changes"}}
{"run":48,"commit":"b4feee9","metric":10953,"metrics":{"eslint_scoped":1,"vitest":107},"status":"keep","description":"Compacted small destructuring assignments","timestamp":1777332649915,"segment":1,"confidence":3.871345029239766,"iterationTokens":2046,"asi":{"hypothesis":"A few destructuring assignments were expanded despite having no complex logic; single-line destructures reduce vertical boilerplate while lint/typecheck pass"}}
{"run":49,"commit":"bfe98fb","metric":10947,"metrics":{"eslint_scoped":1,"vitest":107},"status":"keep","description":"Removed unused files settings reset method","timestamp":1777332682265,"segment":1,"confidence":3.9647058823529413,"iterationTokens":1241,"asi":{"hypothesis":"FilesSettingsCategoryController.reset was not called by app or tests; deleting the unused interface method and implementation removes dead code without behavior change"}}
