{"run":239,"commit":"0fe709a","metric":10073,"metrics":{"loc":10073,"vitest":107,"eslint_scoped":1},"status":"keep","description":"Centralized MCP console error reset","timestamp":1777342189058,"segment":2,"confidence":10.747899159663865,"iterationTokens":2875,"asi":{"hypothesis":"Every MCP test cleared consoleErrors at the start; moving that reset into the runner closure removes repeated setup while preserving per-test error isolation"}}
{"run":240,"commit":"wip","metric":10081,"metrics":{"loc":10081,"vitest":107,"eslint_scoped":1},"status":"discard","description":"Tried shared MCP screenshot result helper","timestamp":1777342232225,"segment":2,"confidence":10.548453608247423,"iterationTokens":1996,"asi":{"hypothesis":"Several MCP tests take a screenshot and immediately return a testResult with the same path; a shared screenshotResult helper might remove duplication","rollback_reason":"Formatted LOC increased from 10073 to 10081 because the helper signature and multiline calls outweighed the duplicated screenshot/return blocks","next_action_hint":"Keep explicit screenshot returns in MCP tests; only refactor if a broader data-driven test shape removes more surrounding code"}}
{"run":241,"commit":"3583a0b","metric":10064,"metrics":{"loc":10064,"vitest":107,"eslint_scoped":1},"status":"keep","description":"Trimmed redundant MCP report summary table","timestamp":1777342255814,"segment":2,"confidence":10.227091633466136,"iterationTokens":1336,"asi":{"hypothesis":"The MCP report already lists every test with status, duration, screenshot, and errors; the trailing summary table duplicated the same information, so replacing it with a concise overall result preserves report usefulness with less generated-report code"}}
{"run":242,"commit":"fde1874","metric":10057,"metrics":{"loc":10057,"vitest":107,"eslint_scoped":1},"status":"keep","description":"Condensed small storage and STT types","timestamp":1777342321093,"segment":2,"confidence":10.0546875,"iterationTokens":2154,"asi":{"hypothesis":"STTSettings and UploadedFile are small structural data shapes; one-line type aliases preserve their contracts with less interface boilerplate, while AppDataCacheSession remains equivalent after type conversion"}}
{"run":243,"commit":"d9a1c55","metric":10051,"metrics":{"loc":10051,"vitest":107,"eslint_scoped":1},"status":"keep","description":"Condensed small settings helper types","timestamp":1777342364490,"segment":2,"confidence":9.885057471264368,"iterationTokens":1114,"asi":{"hypothesis":"PickedTextFile and VoiceSettingsCategorySnapshot are tiny structural shapes; one-line type aliases preserve their contracts and remove interface boilerplate"}}
{"run":244,"commit":"916c487","metric":10045,"metrics":{"loc":10045,"vitest":107,"eslint_scoped":1},"status":"keep","description":"Condensed ingestion data shape types","timestamp":1777342385935,"segment":2,"confidence":9.889101338432122,"iterationTokens":1149,"asi":{"hypothesis":"MarkdownBlock and uploaded-world ingestion shapes are simple structural data carriers; one-line type aliases preserve type checking while reducing boilerplate"}}
{"run":245,"commit":"2dccab1","metric":10040,"metrics":{"loc":10040,"vitest":107,"eslint_scoped":1},"status":"keep","description":"Condensed AI entity input type","timestamp":1777342415708,"segment":2,"confidence":9.889312977099237,"iterationTokens":1439,"asi":{"hypothesis":"AIEntityInput is a compact structural parse shape used locally; a one-line type alias reduces boilerplate while preserving parser typing"}}
{"run":246,"commit":"3345b97","metric":10034,"metrics":{"loc":10034,"vitest":107,"eslint_scoped":1},"status":"keep","description":"Condensed small local helper types","timestamp":1777342456943,"segment":2,"confidence":9.837121212121213,"iterationTokens":2209,"asi":{"hypothesis":"SearchTerm and AnimPair are tiny local structural helper shapes; one-line aliases preserve the same type information with less boilerplate"}}
{"run":247,"commit":"7c5fb7d","metric":10030,"metrics":{"loc":10030,"vitest":107,"eslint_scoped":1},"status":"keep","description":"Condensed details modal props type","timestamp":1777342491637,"segment":2,"confidence":9.778195488721805,"iterationTokens":1812,"asi":{"hypothesis":"EntityDetailsModal Props is a small local object shape; a one-line type alias preserves component props typing while removing interface boilerplate"}}
{"run":248,"commit":"38338e5","metric":10023,"metrics":{"loc":10023,"vitest":107,"eslint_scoped":1},"status":"keep","description":"Condensed SRD data shape types","timestamp":1777342524818,"segment":2,"confidence":9.641404805914972,"iterationTokens":1211,"asi":{"hypothesis":"SRDSource and SRDCache are compact structural data shapes; one-line type aliases preserve the same fields with less boilerplate"}}
{"run":249,"commit":"106bc05","metric":10021,"metrics":{"loc":10021,"vitest":107,"eslint_scoped":1},"status":"keep","description":"Condensed runtime detector type","timestamp":1777342548658,"segment":2,"confidence":9.49090909090909,"iterationTokens":968,"asi":{"hypothesis":"SessionRuntimeDetector is a one-method structural contract; a one-line type alias preserves detector typing with less interface boilerplate"}}
{"run":250,"commit":"1481027","metric":10018,"metrics":{"loc":10018,"vitest":107,"eslint_scoped":1},"status":"keep","description":"Condensed card presentation input type","timestamp":1777342572122,"segment":2,"confidence":9.467391304347826,"iterationTokens":970,"asi":{"hypothesis":"DeriveEntityCardPresentationInput is a two-field structural input type; a one-line alias preserves the function contract with less boilerplate"}}
{"run":251,"commit":"610380b","metric":10014,"metrics":{"loc":10014,"vitest":107,"eslint_scoped":1},"status":"keep","description":"Condensed ingestion options type","timestamp":1777342598026,"segment":2,"confidence":9.413669064748202,"iterationTokens":1068,"asi":{"hypothesis":"NormalizeIngestedEntityOptions is a small three-field options bag; a one-line type alias keeps the same optional fields while removing interface boilerplate"}}
{"run":252,"commit":"289474e","metric":9995,"metrics":{"loc":9995,"vitest":107,"eslint_scoped":1},"status":"keep","description":"Deleted unused Playwright edge config","timestamp":1777342648120,"segment":2,"confidence":9.464991023339318,"iterationTokens":1461,"asi":{"hypothesis":"playwright.edge.config.ts had no package, Justfile, or repository references and duplicated the active Playwright config shape; deleting this unused config removes dead dev-tooling code without affecting the documented screenshot command","metric_note":"Metric command printed a wc warning for deleted playwright.edge.config.ts before staging, but effective post-delete formatted LOC was 9995 and all gates passed"}}
{"run":253,"commit":"c84014a","metric":9994,"metrics":{"loc":9994,"vitest":107,"eslint_scoped":1},"status":"keep","description":"Inlined files settings maybe-promise type","timestamp":1777342682826,"segment":2,"confidence":9.485611510791367,"iterationTokens":1666,"asi":{"hypothesis":"MaybePromise was only used for two ignored service return types; inlining unknown | Promise<unknown> removes the alias without changing controller behavior"}}
{"run":254,"commit":"7798ec3","metric":9992,"metrics":{"loc":9992,"vitest":107,"eslint_scoped":1},"status":"keep","description":"Inlined runtime option callback types","timestamp":1777342714543,"segment":2,"confidence":9.408199643493761,"iterationTokens":1629,"asi":{"hypothesis":"SttSettingsLoader and SttProviderBuilder were only used inside SessionRuntimeOptions; inlining those callback types removes single-use aliases while preserving constructor option typing"}}
{"run":255,"commit":"5b0a9da","metric":9991,"metrics":{"loc":9991,"vitest":107,"eslint_scoped":1},"status":"keep","description":"Inlined runtime interval type alias","timestamp":1777342743864,"segment":2,"confidence":9.328621908127209,"iterationTokens":1059,"asi":{"hypothesis":"DetectionInterval was a single-use alias for ReturnType<typeof setInterval>; inlining it into the field removes a redundant type alias without changing runtime behavior"}}
{"run":256,"commit":"135ed69","metric":9986,"metrics":{"loc":9986,"vitest":107,"eslint_scoped":1},"status":"keep","description":"Condensed ingested entity record shape","timestamp":1777342801141,"segment":2,"confidence":9.329805996472663,"iterationTokens":2857,"asi":{"hypothesis":"IngestedEntityRecord is a bag of optional unknown parsed fields; representing it as a Partial<Record<field, unknown>> preserves validation semantics while removing repetitive optional field declarations"}}
{"run":257,"commit":"2eae59c","metric":9982,"metrics":{"loc":9982,"vitest":107,"eslint_scoped":1},"status":"keep","description":"Grouped string data-source settings fields","timestamp":1777342835071,"segment":2,"confidence":9.294736842105262,"iterationTokens":1188,"asi":{"hypothesis":"Most DataSourcesSettings fields are string credentials/URLs/IDs; modeling them with a Record over the string field names plus explicit SRD fields removes repetitive string declarations while preserving property names and types"}}
{"run":258,"commit":"9eb688a","metric":9973,"metrics":{"loc":9973,"vitest":107,"eslint_scoped":1},"status":"keep","description":"Looped root tab screen declarations","timestamp":1777342945982,"segment":2,"confidence":9.197231833910035,"iterationTokens":1686,"asi":{"hypothesis":"The three root tab screens duplicated the same title/icon options shape; a const tab descriptor list renders the same screens with less repeated JSX","note":"An initial run hit a JSX syntax error while adding the const assertion; after wrapping the array expression correctly, all gates passed"}}
{"run":259,"commit":"wip","metric":9973,"metrics":{"loc":9973,"vitest":107,"eslint_scoped":1},"status":"discard","description":"Tried uniform tab href descriptors","timestamp":1777342983955,"segment":2,"confidence":9.197231833910035,"iterationTokens":1229,"asi":{"hypothesis":"Giving every tab descriptor an href field could simplify the mapped Tabs.Screen options","rollback_reason":"Formatted LOC was unchanged from the current best and the descriptor objects became noisier with explicit undefined href values","next_action_hint":"Keep the conditional href expression unless a larger tab descriptor refactor changes the shape"}}
{"run":260,"commit":"493e8a1","metric":9971,"metrics":{"loc":9971,"vitest":107,"eslint_scoped":1},"status":"keep","description":"Omitted empty console-error lines from MCP report","timestamp":1777343022971,"segment":2,"confidence":9.204152249134948,"iterationTokens":1411,"asi":{"hypothesis":"MCP report sections only need console-error details when errors exist; omitting the repeated 'None' line for clean tests keeps report signal while reducing generator code and output noise"}}
{"run":261,"commit":"wip","metric":9971,"metrics":{"loc":9971,"vitest":107,"eslint_scoped":1},"status":"discard","description":"Tried deriving MCP fail count from pass count","timestamp":1777343049455,"segment":2,"confidence":9.204152249134948,"iterationTokens":1063,"asi":{"hypothesis":"MCP report fail count can be derived from total minus pass count instead of filtering twice","rollback_reason":"Formatted LOC was unchanged from the current best; the change was only a minor expression tweak with no metric improvement","next_action_hint":"Leave the clearer explicit status filtering unless another nearby report refactor changes the code"}}
{"run":262,"commit":"2145c88","metric":9965,"metrics":{"loc":9965,"vitest":107,"eslint_scoped":1},"status":"keep","description":"Derived color scheme labels","timestamp":1777343116453,"segment":2,"confidence":9.208981001727116,"iterationTokens":2522,"asi":{"hypothesis":"Color scheme labels are simple title-cased versions of the scheme IDs; deriving the display label in DisplaySection removes a redundant lookup table while preserving rendered labels"}}
{"run":263,"commit":"4ba6525","metric":9961,"metrics":{"loc":9961,"vitest":107,"eslint_scoped":1},"status":"keep","description":"Used card size IDs as labels","timestamp":1777343161882,"segment":2,"confidence":9.206896551724139,"iterationTokens":1220,"asi":{"hypothesis":"Card size labels duplicated the card size IDs exactly; rendering the size value directly removes the redundant label table without changing UI text"}}
{"run":264,"commit":"e236d81","metric":9960,"metrics":{"loc":9960,"vitest":107,"eslint_scoped":1},"status":"keep","description":"Derived settings category type from descriptors","timestamp":1777343193378,"segment":2,"confidence":9.242214532871973,"iterationTokens":1268,"asi":{"hypothesis":"The Category union and CATEGORIES descriptor IDs duplicated each other; deriving Category from the const descriptor array removes redundant type declarations while preserving literal icon typing"}}
{"run":265,"commit":"35f8a69","metric":9958,"metrics":{"loc":9958,"vitest":107,"eslint_scoped":1},"status":"keep","description":"Inferred card size description keys","timestamp":1777343226389,"segment":2,"confidence":9.28125,"iterationTokens":1309,"asi":{"hypothesis":"CARD_SIZE_DESCS already declares all card-size keys as a const object, so the explicit Record<CardSize,string> annotation and import were redundant; relying on inferred literal keys preserves indexing and reduces boilerplate"}}
{"run":266,"commit":"wip","metric":9958,"metrics":{"loc":9958,"vitest":107,"eslint_scoped":1},"status":"discard","description":"Checked removing generated expo-env types","timestamp":1777343283469,"segment":2,"confidence":9.346153846153847,"iterationTokens":1523,"asi":{"hypothesis":"expo-env.d.ts is generated and says it should be gitignored, so deleting it might reduce tracked LOC while preserving typecheck","rollback_reason":"The file was not tracked in git and therefore not counted by the metric; deleting it produced no LOC improvement","next_action_hint":"Ignore generated untracked Expo env files for this LOC benchmark"}}
{"run":267,"commit":"78a4fcc","metric":9951,"metrics":{"loc":9951,"vitest":107,"eslint_scoped":1},"status":"keep","description":"Trimmed project-limits ESLint plugin noise","timestamp":1777343331928,"segment":2,"confidence":9.305555555555555,"iterationTokens":2489,"asi":{"hypothesis":"The custom project-limits ESLint plugin had an unused ESLint import and comments that restated obvious guard/catch behavior; removing them reduces maintained tooling LOC without changing lint rule behavior"}}
{"run":268,"commit":"806c382","metric":9947,"metrics":{"loc":9947,"vitest":107,"eslint_scoped":1},"status":"keep","description":"Removed legacy ESLint rule doc fields","timestamp":1777343375926,"segment":2,"confidence":9.303292894280762,"iterationTokens":1131,"asi":{"hypothesis":"The local ESLint rule docs included legacy category/recommended metadata that ESLint does not need for rule execution; removing those fields preserves lint behavior and reduces tooling boilerplate"}}
{"run":269,"commit":"b2840dc","metric":9939,"metrics":{"loc":9939,"vitest":107,"eslint_scoped":1},"status":"keep","description":"Shared ESLint max option schema","timestamp":1777343449570,"segment":2,"confidence":9.314878892733564,"iterationTokens":787,"asi":{"hypothesis":"Both custom project-limits rules used the same max option schema; sharing a MAX_OPTION_SCHEMA constant removes duplicated schema objects while preserving rule configuration validation","note":"An initial run exposed a missing comma after replacing the schema blocks; after adding it, syntax check and all gates passed"}}
{"run":270,"commit":"bd5148a","metric":9934,"metrics":{"loc":9934,"vitest":107,"eslint_scoped":1},"status":"keep","description":"Simplified ESLint checked directory state","timestamp":1777343483487,"segment":2,"confidence":9.666666666666666,"iterationTokens":1294,"asi":{"hypothesis":"The max-dir-files rule manually initialized context.settings._checkedDirs with a verbose guard; logical assignment captures the same lazy initialization and checked-dir reuse with less boilerplate"}}
{"run":271,"commit":"cacc68a","metric":9931,"metrics":{"loc":9931,"vitest":107,"eslint_scoped":1},"status":"keep","description":"Simplified ESLint extension filter","timestamp":1777343523706,"segment":2,"confidence":11.065573770491802,"iterationTokens":1330,"asi":{"hypothesis":"The max-dir-files rule repeated four file-extension suffix checks; a single /\\.[jt]sx?$/ regex expresses the same JS/TS file filter with less code"}}
{"run":272,"commit":"00f282d","metric":9930,"metrics":{"loc":9930,"vitest":107,"eslint_scoped":1},"status":"keep","description":"Inlined ESLint source line count","timestamp":1777343556340,"segment":2,"confidence":11.11522633744856,"iterationTokens":985,"asi":{"hypothesis":"The max-lines rule stored sourceCode only to read lines.length once; inlining that access removes a single-use local without changing the line-count check"}}
{"run":273,"commit":"1969d65","metric":9928,"metrics":{"loc":9928,"vitest":107,"eslint_scoped":1},"status":"keep","description":"Inlined ESLint max option defaults","timestamp":1777343608877,"segment":2,"confidence":11.123456790123457,"iterationTokens":1047,"asi":{"hypothesis":"Both project-limits rules only read options.max once; optional chaining with a default removes temporary options objects while preserving configured/default max behavior"}}
{"run":274,"commit":"0f894df","metric":9921,"metrics":{"loc":9921,"vitest":107,"eslint_scoped":1},"status":"keep","description":"Condensed ESLint report data objects","timestamp":1777343642995,"segment":2,"confidence":11.129363449691992,"iterationTokens":1103,"asi":{"hypothesis":"The project-limits report data payloads are small object literals; keeping them inline preserves report interpolation data while reducing verbose object boilerplate"}}
{"run":275,"commit":"ad2f2dc","metric":9920,"metrics":{"loc":9920,"vitest":107,"eslint_scoped":1},"status":"keep","description":"Removed ESLint config type comment","timestamp":1777343714963,"segment":2,"confidence":11.110655737704919,"iterationTokens":1790,"asi":{"hypothesis":"The eslint.config.js JSDoc type annotation is editor metadata only; removing it preserves lint execution and reduces root config LOC"}}
{"run":276,"commit":"326b646","metric":9914,"metrics":{"loc":9914,"vitest":107,"eslint_scoped":1},"status":"keep","description":"Flattened CORS header allow-list string","timestamp":1777343758016,"segment":2,"confidence":11.227272727272727,"iterationTokens":2016,"asi":{"hypothesis":"The worker CORS allow-list was a static array immediately joined into a string; storing the final header string directly preserves the exact allowed headers with less config boilerplate"}}
{"run":277,"commit":"c7134f3","metric":9909,"metrics":{"loc":9909,"vitest":107,"eslint_scoped":1},"status":"keep","description":"Inlined worker origin policy check","timestamp":1777343793472,"segment":2,"confidence":11.341666666666667,"iterationTokens":1154,"asi":{"hypothesis":"The worker origin helper was only used once and wrapped a short allow-list/localhost predicate; inlining the predicate removes a single-use function while preserving the same CORS policy"}}
{"run":278,"commit":"b5f359c","metric":9906,"metrics":{"loc":9906,"vitest":107,"eslint_scoped":1},"status":"keep","description":"Removed app-data persist alias","timestamp":1777343863373,"segment":2,"confidence":11.307053941908714,"iterationTokens":2278,"asi":{"hypothesis":"canPersistAppData only forwarded to isAppDataWriteTokenCurrent after its barrel export was removed; using the token-current predicate directly removes a redundant storage helper while preserving reset/write gating"}}
{"run":279,"commit":"2a29d02","metric":9905,"metrics":{"loc":9905,"vitest":107,"eslint_scoped":1},"status":"keep","description":"Removed redundant native UI settings comment","timestamp":1777343898391,"segment":2,"confidence":11.264462809917354,"iterationTokens":1325,"asi":{"hypothesis":"The UI settings effect comment merely restated the Platform.OS !== 'web' guard; removing it reduces noise while preserving native AsyncStorage loading behavior"}}
{"run":280,"commit":"4931094","metric":9901,"metrics":{"loc":9901,"vitest":107,"eslint_scoped":1},"status":"keep","description":"Grouped EntityCard callback props","timestamp":1777344006957,"segment":2,"confidence":11.617021276595745,"iterationTokens":1325,"asi":{"hypothesis":"EntityCard Props repeats four callback fields with the same () => void type; grouping them with a Record preserves prop names and types while reducing duplicated declarations"}}
{"run":281,"commit":"wip","metric":9904,"metrics":{"loc":9904,"vitest":107,"eslint_scoped":1},"status":"discard","description":"Tried importing settings prop helper types","timestamp":1777344093986,"segment":2,"confidence":11.869565217391305,"iterationTokens":2404,"asi":{"hypothesis":"Replacing inline import() and React.Dispatch qualified types in settings renderer props with imported CardSize/ColorScheme/Dispatch aliases might reduce repetition and improve readability","rollback_reason":"Formatted LOC increased from 9901 to 9904 due to added imports outweighing shorter type references","next_action_hint":"Keep inline type qualifications in src/settings/types.ts unless more references make imports worthwhile"}}
{"run":282,"commit":"5ad3b8c","metric":9896,"metrics":{"loc":9896,"vitest":107,"eslint_scoped":1},"status":"keep","description":"Grouped session context action callbacks","timestamp":1777344143310,"segment":2,"confidence":11.917211328976036,"iterationTokens":2144,"asi":{"hypothesis":"SessionContextType repeated groups of callbacks with identical signatures; using Records for session controls and card actions preserves the public context shape while reducing duplicated type declarations"}}
