{"run":283,"commit":"2f0ecb9","metric":9894,"metrics":{"loc":9894,"vitest":107,"eslint_scoped":1},"status":"keep","description":"Grouped data-sources context callbacks","timestamp":1777344182402,"segment":2,"confidence":11.9,"iterationTokens":1442,"asi":{"hypothesis":"DataSourcesContextType had two no-arg callbacks with identical signatures; grouping them in a Record preserves the context API while removing repeated declarations"}}
{"run":284,"commit":"wip","metric":9894,"metrics":{"loc":9894,"vitest":107,"eslint_scoped":1},"status":"discard","description":"Tried UI settings context type alias","timestamp":1777344227632,"segment":2,"confidence":11.978118161925602,"iterationTokens":1353,"asi":{"hypothesis":"Converting UISettingsContextType from interface to type alias might reduce boilerplate like other small context types","rollback_reason":"Formatted LOC was unchanged from the current best because Prettier kept the same multiline shape with only interface/type syntax swapped","next_action_hint":"Leave UISettingsContextType as an interface unless grouping repeated fields provides real reduction"}}
{"run":285,"commit":"wip","metric":9894,"metrics":{"loc":9894,"vitest":107,"eslint_scoped":1},"status":"discard","description":"Tried removing remaining default React imports","timestamp":1777344354300,"segment":2,"confidence":12.32882882882883,"iterationTokens":1629,"asi":{"hypothesis":"With the modern JSX transform, remaining default React imports in hook-using components/context providers could be removed by importing hooks and ReactNode directly","rollback_reason":"After fixing an initial import replacement mistake, formatted LOC was unchanged from the current best; import reordering/type imports offset removed default imports","next_action_hint":"Leave remaining React imports unless combined with a larger import cleanup that produces a net LOC reduction"}}
{"run":286,"commit":"65c1ce1","metric":9892,"metrics":{"loc":9892,"vitest":107,"eslint_scoped":1},"status":"keep","description":"Inlined pasted-content fallback filename","timestamp":1777344387390,"segment":2,"confidence":12.393665158371041,"iterationTokens":2109,"asi":{"hypothesis":"PASTED_CONTENT_FILE_NAME was a single-use constant read only at the paste-upload fallback; inlining the literal keeps the same default filename while removing unnecessary top-level state"}}
{"run":287,"commit":"e1f6f28","metric":9891,"metrics":{"loc":9891,"vitest":107,"eslint_scoped":1},"status":"keep","description":"Inlined session detection interval option","timestamp":1777344426680,"segment":2,"confidence":12.454545454545455,"iterationTokens":1033,"asi":{"hypothesis":"The session detection interval constant was only used to populate one SessionRuntime option; inlining the 2000ms value removes a single-use constant while preserving the two-second detection cadence documented in the app"}}
{"run":288,"commit":"16587fa","metric":9889,"metrics":{"loc":9889,"vitest":107,"eslint_scoped":1},"status":"keep","description":"Inlined detection context window size","timestamp":1777344486974,"segment":2,"confidence":12.463636363636363,"iterationTokens":1219,"asi":{"hypothesis":"DETECTION_CONTEXT_CHARS was an exported single-use constant; inlining the 80-character slice window removes unused public surface while preserving detection context behavior"}}
{"run":289,"commit":"def3300","metric":9887,"metrics":{"loc":9887,"vitest":107,"eslint_scoped":1},"status":"keep","description":"Inlined card stack capacity","timestamp":1777344533209,"segment":2,"confidence":12.472727272727273,"iterationTokens":1275,"asi":{"hypothesis":"MAX_CARDS was an exported single-use constant now only read by addCard; inlining the stack capacity removes unused public surface while preserving the six-card eviction behavior"}}
{"run":290,"commit":"44b1a5c","metric":9884,"metrics":{"loc":9884,"vitest":107,"eslint_scoped":1},"status":"keep","description":"Inlined entity detector tuning constants","timestamp":1777344595697,"segment":2,"confidence":12.458049886621316,"iterationTokens":1002,"asi":{"hypothesis":"EntityDetector's fuzzy threshold and minimum token length constants were local-only and used directly in the constructor/filter; inlining them removes top-level names while preserving matching behavior","note":"An initial check failed because MIN_CHARS had a second use in the transcript token filter; after inlining both occurrences, all gates passed"}}
{"run":291,"commit":"25f9f80","metric":9882,"metrics":{"loc":9882,"vitest":107,"eslint_scoped":1},"status":"keep","description":"Inlined single-use Google Docs provider constants","timestamp":1777344650802,"segment":2,"confidence":12.438914027149321,"iterationTokens":1780,"asi":{"hypothesis":"Several Google Docs provider constants were only used once for static URL/error strings; inlining them keeps the same fetch URL and error messages while reducing top-level boilerplate"}}
{"run":292,"commit":"c5a2e6e","metric":9877,"metrics":{"loc":9877,"vitest":107,"eslint_scoped":1},"status":"keep","description":"Inlined single-use SRD cache defaults","timestamp":1777344694966,"segment":2,"confidence":12.37752808988764,"iterationTokens":2274,"asi":{"hypothesis":"The SRD default source, cache schema version, and cache TTL constants were each only used in one place; inlining them removes unused public constants while preserving default source selection and cache expiry behavior"}}
{"run":293,"commit":"9d0b598","metric":9874,"metrics":{"loc":9874,"vitest":107,"eslint_scoped":1},"status":"keep","description":"Inlined single-use Notion request constants","timestamp":1777344742269,"segment":2,"confidence":12.308035714285714,"iterationTokens":2091,"asi":{"hypothesis":"The Notion API base URL and version constants were each used only inside fetchBlocks; inlining them keeps the same proxy/direct URL and API version while removing local top-level constants"}}
{"run":294,"commit":"6cf2846","metric":9871,"metrics":{"loc":9871,"vitest":107,"eslint_scoped":1},"status":"keep","description":"Inlined native Deepgram single-use constants","timestamp":1777344785763,"segment":2,"confidence":12.321428571428571,"iterationTokens":1758,"asi":{"hypothesis":"The native Deepgram adapter's audio content type, chunk interval, and recording options constants were each used once; inlining them preserves upload/capture behavior while reducing local boilerplate"}}
{"run":295,"commit":"3325516","metric":9869,"metrics":{"loc":9869,"vitest":107,"eslint_scoped":1},"status":"keep","description":"Inlined browser Deepgram single-use constants","timestamp":1777344844858,"segment":2,"confidence":12.330357142857142,"iterationTokens":1905,"asi":{"hypothesis":"The browser Deepgram adapter's recorder MIME list, connection timeout, and timeslice constants were each used once; inlining them preserves media/WebSocket behavior while trimming local boilerplate"}}
{"run":296,"commit":"bd3cdb1","metric":9867,"metrics":{"loc":9867,"vitest":107,"eslint_scoped":1},"status":"keep","description":"Inlined Kanka API base URL","timestamp":1777344880820,"segment":2,"confidence":12.42247191011236,"iterationTokens":1654,"asi":{"hypothesis":"KANKA_BASE was only used to build the campaign resource URL after campaign-listing code was deleted; inlining the static API origin removes a single-use provider constant while preserving fetch URLs"}}
{"run":297,"commit":"39503e1","metric":9866,"metrics":{"loc":9866,"vitest":107,"eslint_scoped":1},"status":"keep","description":"Inlined app storage key prefixes","timestamp":1777344915597,"segment":2,"confidence":12.51131221719457,"iterationTokens":1052,"asi":{"hypothesis":"APP_STORAGE_PREFIXES was only used by isAppStorageKey; inlining the short prefix list removes a top-level constant while preserving delete-all key matching"}}
{"run":298,"commit":"e382c04","metric":9864,"metrics":{"loc":9864,"vitest":107,"eslint_scoped":1},"status":"keep","description":"Inlined Google Fonts stylesheet URL","timestamp":1777344944082,"segment":2,"confidence":12.72183908045977,"iterationTokens":1217,"asi":{"hypothesis":"The Google Fonts stylesheet constant was only assigned to the dynamically-created link href; inlining the URL preserves font loading while removing a single-use root-layout constant"}}
{"run":299,"commit":"2bcec9f","metric":9862,"metrics":{"loc":9862,"vitest":107,"eslint_scoped":1},"status":"keep","description":"Inlined session runtime test STT settings","timestamp":1777344978695,"segment":2,"confidence":12.939252336448599,"iterationTokens":1683,"asi":{"hypothesis":"The session runtime test STT settings constant was only used by the fake runtime factory; inlining the small settings object removes a test-only constant and unused type import without changing setup behavior"}}
{"run":300,"commit":"wip","metric":9866,"metrics":{"loc":9866,"vitest":107,"eslint_scoped":1},"status":"discard","description":"Tried inlining OG screenshot font path","timestamp":1777345026004,"segment":2,"confidence":13,"iterationTokens":1965,"asi":{"hypothesis":"The OG screenshot Ionicons font path was stored in a single-use constant and could be inlined into the route fulfill call","rollback_reason":"Formatted LOC increased from 9862 to 9866 because the nested path.join/readFileSync call expanded across more lines than the top-level constant","next_action_hint":"Keep the IONICONS_TTF constant in og-screenshot.spec.ts for readability and LOC"}}
{"run":301,"commit":"wip","metric":9863,"metrics":{"loc":9863,"vitest":107,"eslint_scoped":1},"status":"discard","description":"Tried inlining Anthropic endpoint expression","timestamp":1777345077593,"segment":2,"confidence":13.06132075471698,"iterationTokens":2449,"asi":{"hypothesis":"ANTHROPIC_API was only used by the parseWithAI fetch call, so inlining the proxy/direct endpoint expression might remove a single-use constant","rollback_reason":"Formatted LOC increased from 9862 to 9863 because the fetch call expanded after inlining the conditional endpoint","next_action_hint":"Keep ANTHROPIC_API as a readability aid and LOC-neutral/positive constant"}}
{"run":302,"commit":"ea210ac","metric":9859,"metrics":{"loc":9859,"vitest":107,"eslint_scoped":1},"status":"keep","description":"Grouped string fields in files settings snapshot","timestamp":1777345145216,"segment":2,"confidence":13.391304347826088,"iterationTokens":2388,"asi":{"hypothesis":"FilesSettingsCategorySnapshot has three string fields plus a few typed state fields; grouping the string fields with a Record preserves snapshot shape while reducing repetitive declarations"}}
{"run":303,"commit":"b550bea","metric":9856,"metrics":{"loc":9856,"vitest":107,"eslint_scoped":1},"status":"keep","description":"Grouped no-op files settings services","timestamp":1777345174947,"segment":2,"confidence":13.737623762376238,"iterationTokens":1205,"asi":{"hypothesis":"FilesSettingsCategoryControllerOptions had three optional no-argument callbacks with the same signature; grouping them in a Partial<Record<...>> preserves service injection names while reducing repeated declarations"}}
{"run":304,"commit":"f06ecca","metric":9854,"metrics":{"loc":9854,"vitest":107,"eslint_scoped":1},"status":"keep","description":"Grouped files section async handlers","timestamp":1777345240509,"segment":2,"confidence":13.81592039800995,"iterationTokens":2310,"asi":{"hypothesis":"FilesSectionProps had multiple no-argument async handlers with the same signature; grouping the paste/delete-all handlers with a Record preserves prop names while reducing repeated declarations"}}
{"run":305,"commit":"e784299","metric":9852,"metrics":{"loc":9852,"vitest":107,"eslint_scoped":1},"status":"keep","description":"Grouped files section string props","timestamp":1777345277522,"segment":2,"confidence":13.895,"iterationTokens":1768,"asi":{"hypothesis":"FilesSectionProps had three string-valued props; grouping them with a Record preserves names/types and reduces repetitive declarations"}}
{"run":306,"commit":"254f3ff","metric":9851,"metrics":{"loc":9851,"vitest":107,"eslint_scoped":1},"status":"keep","description":"Grouped AI section string props","timestamp":1777345307666,"segment":2,"confidence":13.93483709273183,"iterationTokens":1095,"asi":{"hypothesis":"AISectionProps had two string-valued props alongside typed callbacks/state; grouping the strings with a Record preserves prop names and types while removing a repeated declaration"}}
{"run":307,"commit":"df4097b","metric":9849,"metrics":{"loc":9849,"vitest":107,"eslint_scoped":1},"status":"keep","description":"Grouped runtime snapshot string fields","timestamp":1777345340308,"segment":2,"confidence":13.979899497487438,"iterationTokens":1077,"asi":{"hypothesis":"SessionRuntimeSnapshot had two string-valued fields alongside typed status/card fields; grouping the strings with a Record preserves the snapshot contract while reducing repeated declarations"}}
{"run":308,"commit":"07d5d30","metric":9846,"metrics":{"loc":9846,"vitest":107,"eslint_scoped":1},"status":"keep","description":"Grouped entity string fields","timestamp":1777345368542,"segment":2,"confidence":13.925,"iterationTokens":1019,"asi":{"hypothesis":"Entity has three required string fields plus typed fields; grouping id/name/summary with a Record preserves entity shape while reducing repeated declarations"}}
{"run":309,"commit":"8579baf","metric":9843,"metrics":{"loc":9843,"vitest":107,"eslint_scoped":1},"status":"keep","description":"Grouped card presentation string fields","timestamp":1777345417325,"segment":2,"confidence":13.870646766169154,"iterationTokens":1626,"asi":{"hypothesis":"EntityCardPresentation contains several string-valued presentation fields plus typed state/actions; grouping the string fields with a Record preserves the presentation shape while reducing repeated declarations"}}
{"run":310,"commit":"395f093","metric":9840,"metrics":{"loc":9840,"vitest":107,"eslint_scoped":1},"status":"keep","description":"Grouped MCP test result string fields","timestamp":1777345468936,"segment":2,"confidence":13.885572139303482,"iterationTokens":1658,"asi":{"hypothesis":"TestResult has required status/errors/duration plus string-valued name and optional messages/paths; grouping the string fields preserves report data shape while reducing declarations"}}
{"run":311,"commit":"a181ef2","metric":9835,"metrics":{"loc":9835,"vitest":107,"eslint_scoped":1},"status":"keep","description":"Grouped layout numeric result fields","timestamp":1777345513510,"segment":2,"confidence":13.91044776119403,"iterationTokens":1703,"asi":{"hypothesis":"ReferenceCardLayout returns several numeric layout fields plus a positions map; grouping numeric fields with a Record preserves the result shape while reducing repeated declarations"}}
{"run":312,"commit":"ca8f591","metric":9831,"metrics":{"loc":9831,"vitest":107,"eslint_scoped":1},"status":"keep","description":"Removed explicit Playwright defaults","timestamp":1777368809911,"segment":2,"confidence":13.82716049382716,"iterationTokens":1703,"asi":{"hypothesis":"Playwright config explicitly set values matching framework defaults (serial execution, zero retries, list reporter, video off); removing them preserves test behavior while reducing config LOC","default_values_removed":["fullyParallel:false","retries:0","reporter:list","use.video:off"]}}
{"run":313,"commit":"2b10342","metric":9813,"metrics":{"loc":9813,"vitest":107,"eslint_scoped":1},"status":"keep","description":"Grouped theme color key types","timestamp":1777368843185,"segment":2,"confidence":13.813725490196079,"iterationTokens":8320,"asi":{"hypothesis":"The Colors interface listed many string-valued palette keys; grouping related keys with Record intersections preserves the exact color object contract while removing repetitive declarations","groups":["background","border","text","semantic/accent"]}}
{"run":314,"commit":"01fc709","metric":9810,"metrics":{"loc":9810,"vitest":107,"eslint_scoped":1},"status":"keep","description":"Grouped STT provider lifecycle methods","timestamp":1777368865669,"segment":2,"confidence":13.82843137254902,"iterationTokens":9260,"asi":{"hypothesis":"pause/resume/stop share the same provider lifecycle signature; grouping them with a Record keeps the STTProvider contract while removing repeated method declarations"}}
{"run":315,"commit":"baef8fe","metric":9806,"metrics":{"loc":9806,"vitest":107,"eslint_scoped":1},"status":"keep","description":"Removed unused data-sources default re-export","timestamp":1777368887511,"segment":2,"confidence":13.848039215686274,"iterationTokens":3254,"asi":{"hypothesis":"DEFAULT_DATA_SOURCES_SETTINGS is consumed from the storage barrel in tests and not through the data-sources context barrel; dropping the unused context re-export preserves app imports while reducing export boilerplate"}}
{"run":316,"commit":"fee0710","metric":9798,"metrics":{"loc":9798,"vitest":107,"eslint_scoped":1},"status":"keep","description":"Shared card border settings styles","timestamp":1777368918706,"segment":2,"confidence":13.955665024630543,"iterationTokens":4661,"asi":{"hypothesis":"Several settings style blocks repeat the same card background/border/radius properties; a local cardBorder style fragment preserves rendered styles while reducing repeated object fields","shared_styles":["segment","optionRow","toggleRow"]}}
{"run":317,"commit":"5ef1662","metric":9790,"metrics":{"loc":9790,"vitest":107,"eslint_scoped":1},"status":"keep","description":"Shared settings action button border styles","timestamp":1777368935430,"segment":2,"confidence":14.064356435643564,"iterationTokens":1327,"asi":{"hypothesis":"Settings outline and danger buttons use identical centered bordered button structure with only border color differing; sharing the base actionBorder fragment preserves style output and removes repetition"}}
{"run":318,"commit":"cde84d8","metric":9785,"metrics":{"loc":9785,"vitest":107,"eslint_scoped":1},"status":"keep","description":"Shared compact settings card border styles","timestamp":1777368957513,"segment":2,"confidence":14.337531486146096,"iterationTokens":2973,"asi":{"hypothesis":"Checkbox source rows and uploaded file rows repeat the card background/border fields with a smaller radius; deriving compactCardBorder from cardBorder preserves styling while removing duplicated fields","shared_styles":["checkRow","fileRow"]}}
{"run":319,"commit":"0c03ff0","metric":9780,"metrics":{"loc":9780,"vitest":107,"eslint_scoped":1},"status":"keep","description":"Shared centered border control styles","timestamp":1777368977373,"segment":2,"confidence":14.62051282051282,"iterationTokens":1660,"asi":{"hypothesis":"The checkbox and file remove button both center icon content inside a small bordered rounded box; sharing those base fields preserves visual output while reducing repeated style declarations","shared_styles":["checkbox","fileRemoveBtn"]}}
{"run":320,"commit":"57de904","metric":9754,"metrics":{"loc":9754,"vitest":107,"eslint_scoped":1},"status":"keep","description":"Collapsed session provider callback wrappers","timestamp":1777369001403,"segment":2,"confidence":14.945454545454545,"iterationTokens":5930,"asi":{"hypothesis":"SessionProvider's useCallback wrappers only forward one call to the runtime; expressing each as a direct expression callback preserves stable references and runtime delegation while removing block boilerplate"}}
{"run":321,"commit":"2f3662f","metric":9752,"metrics":{"loc":9752,"vitest":107,"eslint_scoped":1},"status":"keep","description":"Collapsed uploads version callback","timestamp":1777369024456,"segment":2,"confidence":15.152631578947368,"iterationTokens":2927,"asi":{"hypothesis":"bumpUploads only forwards a functional state increment; using an expression-bodied useCallback preserves stable identity and behavior while removing callback block boilerplate"}}
{"run":322,"commit":"wip","metric":9752,"metrics":{"loc":9752,"vitest":107,"eslint_scoped":1},"status":"discard","description":"Tried inferred setter callback parameter types","timestamp":1777369043679,"segment":2,"confidence":15.354666666666667,"iterationTokens":1699,"asi":{"hypothesis":"Replacing Dispatch generic useCallback annotations with typed parameters might remove import/type boilerplate in settings hooks","rollback_reason":"Formatted LOC was unchanged because Prettier kept the replacement callback lines long/multiline enough to offset the removed Dispatch imports","next_action_hint":"Leave settings setter callbacks in their current generic form unless combined with a larger hook-return refactor"}}
{"run":323,"commit":"b2364af","metric":9751,"metrics":{"loc":9751,"vitest":107,"eslint_scoped":1},"status":"keep","description":"Collapsed card height layout update","timestamp":1777369063862,"segment":2,"confidence":15.567567567567568,"iterationTokens":2601,"asi":{"hypothesis":"CardGrid's layout callback only conditionally returns the previous height map or an updated copy; using a ternary in the state updater preserves no-op behavior while reducing block boilerplate"}}
{"run":324,"commit":"d3239c5","metric":9749,"metrics":{"loc":9749,"vitest":107,"eslint_scoped":1},"status":"keep","description":"Collapsed native capture enqueue wrapper","timestamp":1777369099236,"segment":2,"confidence":15.620596205962059,"iterationTokens":5173,"asi":{"hypothesis":"startNativeCapture only enqueued startNativeChunks through an unnecessary async block; passing the method call wrapper directly preserves Promise sequencing while reducing boilerplate"}}
