{"run":413,"commit":"b4c495d","metric":9396,"metrics":{"loc":9396,"vitest":107,"eslint_scoped":1},"status":"keep","description":"Collapsed browser Deepgram stop helper","timestamp":1777372280862,"segment":2,"confidence":11.763636363636364,"iterationTokens":868,"asi":{"hypothesis":"Browser Deepgram stop only marks capture inactive and runs cleanup; expression-bodied field preserves stop behavior while removing simple method boilerplate"}}
{"run":414,"commit":"fbccaec","metric":9393,"metrics":{"loc":9393,"vitest":107,"eslint_scoped":1},"status":"keep","description":"Collapsed browser Deepgram pause helper","timestamp":1777372304991,"segment":2,"confidence":11.753176043557168,"iterationTokens":885,"asi":{"hypothesis":"Browser Deepgram pause only marks inactive and pauses an active recorder; expression-bodied field preserves the guard and side effects while reducing method boilerplate"}}
{"run":415,"commit":"2f1e22e","metric":9387,"metrics":{"loc":9387,"vitest":107,"eslint_scoped":1},"status":"keep","description":"Collapsed native Deepgram pause/resume helpers","timestamp":1777372332716,"segment":2,"confidence":11.753623188405797,"iterationTokens":915,"asi":{"hypothesis":"Native Deepgram pause/resume only update active state and return the corresponding capture operation; expression-bodied fields preserve promise sequencing while reducing boilerplate"}}
{"run":416,"commit":"0092dd8","metric":9384,"metrics":{"loc":9384,"vitest":107,"eslint_scoped":1},"status":"keep","description":"Collapsed lifecycle current-capture predicates","timestamp":1777372375358,"segment":2,"confidence":11.658886894075405,"iterationTokens":1626,"asi":{"hypothesis":"Late-event-safe provider current-capture checks are pure predicates; expression-bodied private fields preserve delivery guards while reducing method boilerplate"}}
{"run":417,"commit":"fbc2dcf","metric":9382,"metrics":{"loc":9382,"vitest":107,"eslint_scoped":1},"status":"keep","description":"Collapsed session runtime error formatter","timestamp":1777372398084,"segment":2,"confidence":11.562277580071175,"iterationTokens":808,"asi":{"hypothesis":"SessionRuntime formatError is a pure one-expression formatter; expression-bodied private field preserves error message handling while trimming method boilerplate"}}
{"run":418,"commit":"f811486","metric":9381,"metrics":{"loc":9381,"vitest":107,"eslint_scoped":1},"status":"keep","description":"Collapsed Web Speech action error formatter","timestamp":1777372427392,"segment":2,"confidence":11.565836298932384,"iterationTokens":862,"asi":{"hypothesis":"WebSpeechProvider actionError is a pure permission-vs-generic formatter; expression-bodied private field preserves error messages while reducing method wrapper boilerplate"}}
{"run":419,"commit":"ad05079","metric":9379,"metrics":{"loc":9379,"vitest":107,"eslint_scoped":1},"status":"keep","description":"Collapsed snapshot getter","timestamp":1777372457440,"segment":2,"confidence":11.572953736654805,"iterationTokens":788,"asi":{"hypothesis":"SnapshotStore getSnapshot simply returns the current snapshot; expression-bodied instance field preserves the public getter function while reducing boilerplate"}}
{"run":420,"commit":"77173c6","metric":9373,"metrics":{"loc":9373,"vitest":107,"eslint_scoped":1},"status":"keep","description":"Collapsed simple snapshot store helpers","timestamp":1777372486793,"segment":2,"confidence":11.594306049822064,"iterationTokens":1173,"asi":{"hypothesis":"SnapshotStore subscribe cleanup, updateSnapshot, and clearSnapshotListeners are small forwarding helpers; expression-bodied forms preserve listener semantics while reducing boilerplate"}}
{"run":421,"commit":"929a2ac","metric":9370,"metrics":{"loc":9370,"vitest":107,"eslint_scoped":1},"status":"keep","description":"Collapsed fake detector capture method","timestamp":1777372512268,"segment":2,"confidence":11.604982206405694,"iterationTokens":1793,"asi":{"hypothesis":"FakeDetector detect only records the input then delegates to its responder; expression-bodied method preserves test instrumentation while reducing boilerplate"}}
{"run":422,"commit":"bf9eb0a","metric":9368,"metrics":{"loc":9368,"vitest":107,"eslint_scoped":1},"status":"keep","description":"Collapsed snapshot replacement notifier","timestamp":1777372538739,"segment":2,"confidence":11.42907180385289,"iterationTokens":836,"asi":{"hypothesis":"SnapshotStore replaceSnapshot only assigns the snapshot then notifies listeners; expression-bodied form preserves ordering and listener behavior while reducing boilerplate"}}
{"run":423,"commit":"f8bc0e5","metric":9367,"metrics":{"loc":9367,"vitest":107,"eslint_scoped":1},"status":"keep","description":"Collapsed voice settings reset command","timestamp":1777372563720,"segment":2,"confidence":11.255172413793103,"iterationTokens":875,"asi":{"hypothesis":"Voice settings reset performs a fixed sequence of generation bump, timer cleanup, and snapshot replacement; expression-bodied command preserves ordering while trimming method boilerplate"}}
{"run":424,"commit":"0f08c66","metric":9366,"metrics":{"loc":9366,"vitest":107,"eslint_scoped":1},"status":"keep","description":"Collapsed voice settings dispose command","timestamp":1777372594585,"segment":2,"confidence":11.219931271477662,"iterationTokens":886,"asi":{"hypothesis":"Voice settings dispose performs a fixed cleanup sequence; expression-bodied command preserves disposal ordering and cleanup calls while reducing method boilerplate"}}
{"run":425,"commit":"247bb6c","metric":9362,"metrics":{"loc":9362,"vitest":107,"eslint_scoped":1},"status":"keep","description":"Collapsed files settings dispose command","timestamp":1777372627089,"segment":2,"confidence":11.195205479452055,"iterationTokens":983,"asi":{"hypothesis":"Files settings dispose performs a fixed disposed flag, generation bump, and listener cleanup sequence; expression-bodied command preserves cleanup ordering while reducing boilerplate"}}
{"run":426,"commit":"20e5e58","metric":9361,"metrics":{"loc":9361,"vitest":107,"eslint_scoped":1},"status":"keep","description":"Collapsed app data core test reset helper","timestamp":1777372662074,"segment":2,"confidence":11.160409556313994,"iterationTokens":1145,"asi":{"hypothesis":"App data core test reset performs a fixed sequence of module-state assignments; expression-bodied export preserves reset state while reducing boilerplate"}}
{"run":427,"commit":"9fc3d22","metric":9359,"metrics":{"loc":9359,"vitest":107,"eslint_scoped":1},"status":"keep","description":"Collapsed upload mutation test reset helper","timestamp":1777372695156,"segment":2,"confidence":11.129251700680273,"iterationTokens":919,"asi":{"hypothesis":"The uploaded-file mutation queue test reset only assigns a resolved promise; expression-bodied export preserves reset behavior while trimming wrapper boilerplate"}}
{"run":428,"commit":"fd87a3e","metric":9357,"metrics":{"loc":9357,"vitest":107,"eslint_scoped":1},"status":"keep","description":"Collapsed combined app data test reset helper","timestamp":1777372723392,"segment":2,"confidence":10.949832775919733,"iterationTokens":1264,"asi":{"hypothesis":"The app-data barrel test reset helper only delegates to the two module reset helpers; expression-bodied export preserves reset ordering while removing wrapper boilerplate"}}
{"run":429,"commit":"fe60609","metric":9355,"metrics":{"loc":9355,"vitest":107,"eslint_scoped":1},"status":"keep","description":"Collapsed small app data and Deepgram guard exports","timestamp":1777372765204,"segment":2,"confidence":10.776315789473685,"iterationTokens":1279,"asi":{"hypothesis":"allowAppDataCacheWrites and assertDeepgramApiKey are tiny guard/assignment exports; expression-bodied/arrow exports preserve behavior while reducing wrapper boilerplate"}}
{"run":430,"commit":"wip","metric":9355,"metrics":{"loc":9355,"vitest":107,"eslint_scoped":1},"status":"discard","description":"Tried expression-bodied app data reset begin, but LOC was unchanged","timestamp":1777372799566,"segment":2,"confidence":10.58481421647819,"iterationTokens":1173,"asi":{"hypothesis":"beginAppDataReset is a fixed state-update-and-return sequence that could be expression-bodied","rollback_reason":"Prettier wrapped the comma expression enough that formatted LOC was unchanged from 9355","next_action_hint":"Keep imperative state transition helpers when expression-bodied forms do not improve the metric and are less clear"}}
{"run":431,"commit":"5487793","metric":9354,"metrics":{"loc":9354,"vitest":107,"eslint_scoped":1},"status":"keep","description":"Collapsed alias splitting helper","timestamp":1777372846150,"segment":2,"confidence":10.403174603174604,"iterationTokens":1380,"asi":{"hypothesis":"splitAliasString is a pure string-splitting pipeline; expression-bodied constant preserves alias normalization while trimming wrapper boilerplate"}}
{"run":432,"commit":"3b1e07b","metric":9353,"metrics":{"loc":9353,"vitest":107,"eslint_scoped":1},"status":"keep","description":"Collapsed Notion markdown conversion helper","timestamp":1777372887729,"segment":2,"confidence":10.373417721518987,"iterationTokens":1863,"asi":{"hypothesis":"blocksToMarkdown is a pure block-to-string pipeline; expression-bodied constant preserves Notion markdown conversion while trimming wrapper boilerplate"}}
{"run":433,"commit":"f371750","metric":9348,"metrics":{"loc":9348,"vitest":107,"eslint_scoped":1},"status":"keep","description":"Collapsed component style factory wrappers","timestamp":1777372923100,"segment":2,"confidence":10.35646687697161,"iterationTokens":1449,"asi":{"hypothesis":"Several component createStyles helpers only return StyleSheet.create objects; expression-bodied constants preserve style generation while removing identical return wrapper boilerplate","files":["app/debug.tsx","src/components/CardGrid.tsx","src/components/EntityCard.tsx","src/components/EntityDetailsModal.tsx","src/components/SessionControls.tsx"]}}
{"run":434,"commit":"5dd49c6","metric":9327,"metrics":{"loc":9327,"vitest":107,"eslint_scoped":1},"status":"keep","description":"Merged reference layout viewport table tests","timestamp":1777372996823,"segment":2,"confidence":10.373626373626374,"iterationTokens":3651,"asi":{"hypothesis":"Portrait and landscape reference-card layout tests shared the same setup/assertion body with only viewport and expected values changing; one table preserves all cases and test count while removing duplicate bodies"}}
{"run":435,"commit":"d825704","metric":9317,"metrics":{"loc":9317,"vitest":107,"eslint_scoped":1},"status":"keep","description":"Table-driven entity summary bullet cases","timestamp":1777373051715,"segment":2,"confidence":10.35625,"iterationTokens":3639,"asi":{"hypothesis":"Entity summary bullet tests shared the same input-to-expected-bullets assertion shape; table-driving sentence splitting, limiting, and punctuation cases preserves coverage and test count while removing repeated test bodies"}}
{"run":436,"commit":"ecb952f","metric":9303,"metrics":{"loc":9303,"vitest":107,"eslint_scoped":1},"status":"keep","description":"Shared markdown provider sample document fixture","timestamp":1777373086280,"segment":2,"confidence":10.31937984496124,"iterationTokens":2262,"asi":{"hypothesis":"MarkdownProvider tests duplicated the same sample markdown document; lifting it to a shared fixture preserves both assertions while removing repeated test data"}}
{"run":437,"commit":"4595c7f","metric":9302,"metrics":{"loc":9302,"vitest":107,"eslint_scoped":1},"status":"keep","description":"Aliased voice settings normalizer export","timestamp":1777373129913,"segment":2,"confidence":10.243076923076924,"iterationTokens":2321,"asi":{"hypothesis":"mergeVoiceSettings is exactly the normalizeVoiceSettings function with a narrower exported signature; typed aliasing preserves callers while removing a forwarding wrapper"}}
{"run":438,"commit":"wip","metric":9304,"metrics":{"loc":9304,"vitest":107,"eslint_scoped":1},"status":"discard","description":"Tried grouping file-upload setup adds, but wrapping increased LOC","timestamp":1777373178589,"segment":2,"confidence":10.164885496183206,"iterationTokens":3387,"asi":{"hypothesis":"Independent file-upload test setup adds could run through one Promise.all to reduce repeated await statements","rollback_reason":"Prettier wrapped the Promise.all call over more lines than the three simple awaits, increasing LOC from 9303 to 9304","next_action_hint":"Keep short sequential setup awaits unless grouping also removes larger repeated blocks"}}
{"run":439,"commit":"af1637f","metric":9282,"metrics":{"loc":9282,"vitest":107,"eslint_scoped":1},"status":"keep","description":"Reused shared speech mock in OG screenshot test","timestamp":1777373214765,"segment":2,"confidence":10.148484848484848,"iterationTokens":2306,"asi":{"hypothesis":"The OG screenshot test duplicated the Playwright speech-recognition mock already provided by e2e/helpers; reusing injectSpeechMock preserves the __speak contract while removing duplicate mock setup"}}
{"run":440,"commit":"d370b2e","metric":9269,"metrics":{"loc":9269,"vitest":107,"eslint_scoped":1},"status":"keep","description":"Shared E2E external route mocks","timestamp":1777373260738,"segment":2,"confidence":10.172465960665658,"iterationTokens":1864,"asi":{"hypothesis":"setupTest and the OG screenshot setup duplicated Ionicons CDN and Open5e route mocks; extracting mockExternalRoutes preserves route behavior while removing duplicate setup and imports"}}
{"run":441,"commit":"2480be7","metric":9265,"metrics":{"loc":9265,"vitest":107,"eslint_scoped":1},"status":"keep","description":"Inlined OG screenshot setup wrapper","timestamp":1777373305503,"segment":2,"confidence":10.169184290030211,"iterationTokens":1133,"asi":{"hypothesis":"After sharing speech and route mocks, the OG screenshot local setup helper only called two helpers once; inlining those calls preserves setup order while removing an unnecessary wrapper and Page import"}}
{"run":442,"commit":"dbecd64","metric":9264,"metrics":{"loc":9264,"vitest":107,"eslint_scoped":1},"status":"keep","description":"Shared screenshot page-settle helper","timestamp":1777373359046,"segment":2,"confidence":10.187594553706505,"iterationTokens":2346,"asi":{"hypothesis":"Light and dark screenshot specs duplicated the same networkidle-plus-timeout wait helper; exporting waitForSettledPage from e2e helpers preserves screenshot timing while removing duplicate definitions"}}
{"run":443,"commit":"wip","metric":9264,"metrics":{"loc":9264,"vitest":107,"eslint_scoped":1},"status":"discard","description":"Tried arrow controller test factories, but LOC was unchanged","timestamp":1777373401208,"segment":2,"confidence":10.203030303030303,"iterationTokens":2086,"asi":{"hypothesis":"Settings controller test factories might be shorter as arrow constants","rollback_reason":"The arrow form required a trailing semicolon and preserved the same block shape, so formatted LOC stayed at 9264","next_action_hint":"Leave multi-statement factory helpers as function declarations unless other changes remove block structure"}}
{"run":444,"commit":"0b298eb","metric":9263,"metrics":{"loc":9263,"vitest":107,"eslint_scoped":1},"status":"keep","description":"Inlined MCP initial screenshot path","timestamp":1777373444946,"segment":2,"confidence":10.175226586102719,"iterationTokens":3397,"asi":{"hypothesis":"The MCP card-size test stored its initial screenshot path only to pass it once to saveScreenshot; inlining the path removes a temporary variable without changing screenshot capture"}}
{"run":445,"commit":"8e981bf","metric":9262,"metrics":{"loc":9262,"vitest":107,"eslint_scoped":1},"status":"keep","description":"Collapsed setupTestWithSession sequence","timestamp":1777373474749,"segment":2,"confidence":10.147590361445783,"iterationTokens":1145,"asi":{"hypothesis":"setupTestWithSession only runs setupTest then startSession; chaining the promises preserves ordering while reducing helper boilerplate"}}
{"run":446,"commit":"e807e1e","metric":9260,"metrics":{"loc":9260,"vitest":107,"eslint_scoped":1},"status":"keep","description":"Collapsed setupTestWithSession export","timestamp":1777373532991,"segment":2,"confidence":10.123123123123124,"iterationTokens":851,"asi":{"hypothesis":"setupTestWithSession is a promise composition of setupTest and startSession; expression-bodied export preserves sequencing while removing wrapper syntax"}}
{"run":447,"commit":"wip","metric":9263,"metrics":{"loc":9263,"vitest":107,"eslint_scoped":1},"status":"discard","description":"Tried promise-chained session E2E helpers, but wrapping increased LOC","timestamp":1777373561344,"segment":2,"confidence":10.092814371257486,"iterationTokens":1213,"asi":{"hypothesis":"start/pause/stop E2E helpers could be shorter as promise chains instead of async blocks","rollback_reason":"The chained locator calls wrapped over multiple lines, increasing LOC from 9260 to 9263","next_action_hint":"Keep multi-step Playwright helpers as async blocks unless a chain stays on one formatted line"}}
{"run":448,"commit":"wip","metric":9260,"metrics":{"loc":9260,"vitest":107,"eslint_scoped":1},"status":"discard","description":"Tried compact UI settings reset callback, but LOC was unchanged","timestamp":1777373635658,"segment":2,"confidence":10.092814371257486,"iterationTokens":4701,"asi":{"hypothesis":"resetUISettings only resets two state values and could be a compact expression callback","rollback_reason":"Prettier expanded the useCallback arguments enough that formatted LOC stayed unchanged at 9260 while readability decreased","next_action_hint":"Leave small multi-statement React callbacks alone unless the expression form stays on one line"}}
{"run":449,"commit":"wip","metric":9260,"metrics":{"loc":9260,"vitest":107,"eslint_scoped":1},"status":"discard","description":"Tried compact data source replacement callback, but LOC was unchanged","timestamp":1777373679710,"segment":2,"confidence":10.092814371257486,"iterationTokens":1618,"asi":{"hypothesis":"replaceSettings only updates a ref and state and could be expression-bodied","rollback_reason":"Prettier expanded the useCallback call enough that LOC stayed unchanged at 9260 while readability decreased","next_action_hint":"Avoid compacting small React callbacks when hook formatting offsets the saved block lines"}}
{"run":450,"commit":"955f6d9","metric":9256,"metrics":{"loc":9256,"vitest":107,"eslint_scoped":1},"status":"keep","description":"Shared Scarab card setup in modal E2E tests","timestamp":1777373767032,"segment":2,"confidence":10.119940029985008,"iterationTokens":5608,"asi":{"hypothesis":"Entity details modal tests repeated the same speech, wait, card locator, and visibility setup; a shared showScarabCard helper preserves setup behavior while removing duplicate blocks"}}
{"run":451,"commit":"3e28f5c","metric":9251,"metrics":{"loc":9251,"vitest":107,"eslint_scoped":1},"status":"keep","description":"Shared E2E speak-and-detect wait helper","timestamp":1777373839842,"segment":2,"confidence":10.15015015015015,"iterationTokens":4410,"asi":{"hypothesis":"Entity-detection, edge-case, and modal E2E tests repeatedly speak then wait for the detection interval; a shared speakAndWait helper preserves timing while removing duplicated two-line sequences"}}
{"run":452,"commit":"d787f22","metric":9243,"metrics":{"loc":9243,"vitest":107,"eslint_scoped":1},"status":"keep","description":"Reused speakAndWait across more E2E specs","timestamp":1777373896442,"segment":2,"confidence":10.204819277108435,"iterationTokens":2374,"asi":{"hypothesis":"Screenshot, card interaction, and eviction E2E specs also repeated speak plus detection-wait sequences; using speakAndWait preserves timing while removing duplicated waits and imports"}}
