{"run":325,"commit":"wip","metric":9749,"metrics":{"loc":9749,"vitest":107,"eslint_scoped":1},"status":"discard","description":"Tried removing async from native stop enqueue wrapper","timestamp":1777369116124,"segment":2,"confidence":15.748633879781421,"iterationTokens":1058,"asi":{"hypothesis":"stopNativeCapture could return stopCurrentRecording directly from the enqueue callback instead of awaiting it in an async block","rollback_reason":"Formatted LOC was unchanged because the explicit return form kept the same multiline shape as the async/await block","next_action_hint":"Keep the clearer async stop wrapper unless combined with broader native capture refactoring"}}
{"run":326,"commit":"cf4b9dd","metric":9748,"metrics":{"loc":9748,"vitest":107,"eslint_scoped":1},"status":"keep","description":"Delegated native Deepgram stop to pause","timestamp":1777369135829,"segment":2,"confidence":15.840659340659341,"iterationTokens":1137,"asi":{"hypothesis":"Native Deepgram stop and pause perform the same deactivation and capture shutdown; delegating stop to pause preserves lifecycle behavior while removing duplicate method body code"}}
{"run":327,"commit":"93f203f","metric":9746,"metrics":{"loc":9746,"vitest":107,"eslint_scoped":1},"status":"keep","description":"Collapsed Deepgram browser message handler","timestamp":1777369150213,"segment":2,"confidence":15.851648351648352,"iterationTokens":1058,"asi":{"hypothesis":"The browser Deepgram WebSocket onmessage handler only forwards event data to one method; using an expression-bodied handler preserves behavior while removing block boilerplate"}}
{"run":328,"commit":"7a9a4e5","metric":9736,"metrics":{"loc":9736,"vitest":107,"eslint_scoped":1},"status":"keep","description":"Collapsed simple Playwright setup hooks","timestamp":1777369193255,"segment":2,"confidence":15.906593406593407,"iterationTokens":4680,"asi":{"hypothesis":"Several Playwright beforeEach hooks only await a setup helper and screenshots imported unused expect; expression-bodied hooks and removing the unused import preserve test setup while trimming boilerplate","files":["screenshots.spec.ts","card-eviction.spec.ts","entity-details-modal.spec.ts","entity-detection.spec.ts","session-controls.spec.ts"]}}
{"run":329,"commit":"wip","metric":9734,"metrics":{"loc":9734,"vitest":0,"eslint_scoped":0},"status":"crash","description":"Tried expression-bodied screenshot test","timestamp":1777369209147,"segment":2,"confidence":15.994475138121548,"iterationTokens":1281,"asi":{"hypothesis":"The idle screenshot test body could be expression-bodied like setup hooks","rollback_reason":"TypeScript rejects returning Promise<Buffer> from Playwright test callback, which must return void/Promise<void>","next_action_hint":"Do not expression-body Playwright callbacks that return non-void helper promises unless wrapping with void or an async block"}}
{"run":330,"commit":"wip","metric":9736,"metrics":{"loc":9736,"vitest":107,"eslint_scoped":1},"status":"discard","description":"Tried removing redundant async from speech count helper","timestamp":1777369236735,"segment":2,"confidence":16.0387811634349,"iterationTokens":2330,"asi":{"hypothesis":"getSpeechStartCount returned page.evaluate directly, so dropping async could simplify the helper","rollback_reason":"Formatted LOC was unchanged because removing async did not alter line count","next_action_hint":"Only pursue async removal when it enables collapsing a larger function body or removes awaits/imports"}}
{"run":331,"commit":"8090b2a","metric":9734,"metrics":{"loc":9734,"vitest":107,"eslint_scoped":1},"status":"keep","description":"Simplified debug transcript append handler","timestamp":1777369263721,"segment":2,"confidence":16.18435754189944,"iterationTokens":2872,"asi":{"hypothesis":"The debug screen transcript is typed as a string, so nullish fallbacks are unnecessary; using an expression-bodied append guard preserves append-only behavior while reducing handler boilerplate"}}
{"run":332,"commit":"18c0086","metric":9727,"metrics":{"loc":9727,"vitest":107,"eslint_scoped":1},"status":"keep","description":"Mapped debug STT status colors","timestamp":1777369285615,"segment":2,"confidence":16.453257790368273,"iterationTokens":1090,"asi":{"hypothesis":"Debug STT status color selection is a total mapping over the SttStatus union; an object lookup preserves the same colors while removing nested ternary boilerplate"}}
{"run":333,"commit":"e1a70a3","metric":9725,"metrics":{"loc":9725,"vitest":107,"eslint_scoped":1},"status":"keep","description":"Mapped session status labels","timestamp":1777369304279,"segment":2,"confidence":16.418079096045197,"iterationTokens":1176,"asi":{"hypothesis":"SessionControls status labels are deterministic lookups where STT connecting/error override session status; mapping lookups preserve label precedence while reducing conditional assignment boilerplate"}}
{"run":334,"commit":"ba21c8e","metric":9723,"metrics":{"loc":9723,"vitest":107,"eslint_scoped":1},"status":"keep","description":"Collapsed app-data test multiRemove mock","timestamp":1777369328492,"segment":2,"confidence":16.383098591549295,"iterationTokens":4605,"asi":{"hypothesis":"The AsyncStorage multiRemove mock only iterates keys to delete them from the in-memory map; expression-bodied callback preserves mock behavior while trimming boilerplate"}}
{"run":335,"commit":"a6a2e53","metric":9713,"metrics":{"loc":9713,"vitest":107,"eslint_scoped":1},"status":"keep","description":"Collapsed storage mock mutation callbacks","timestamp":1777369370023,"segment":2,"confidence":16.39325842696629,"iterationTokens":2736,"asi":{"hypothesis":"Several test AsyncStorage mocks use callbacks whose only statement mutates an in-memory Map; expression-bodied setItem/multiRemove mocks preserve test behavior while reducing repeated block boilerplate","files":["build-provider.test.ts","file-upload.test.ts","srd.test.ts"]}}
{"run":336,"commit":"8f547e2","metric":9705,"metrics":{"loc":9705,"vitest":107,"eslint_scoped":1},"status":"keep","description":"Collapsed single-statement test cleanup hooks","timestamp":1777369420397,"segment":2,"confidence":16.43820224719101,"iterationTokens":1885,"asi":{"hypothesis":"Several Vitest afterEach hooks contain only one cleanup call; expression-bodied hooks preserve cleanup sequencing while reducing boilerplate","files":["deepgram-native.test.ts","files-settings-category.test.ts","file-upload.test.ts","google-docs.test.ts"]}}
{"run":337,"commit":"91104bc","metric":9701,"metrics":{"loc":9701,"vitest":107,"eslint_scoped":1},"status":"keep","description":"Collapsed lifecycle-safe test assignment callbacks","timestamp":1777369457557,"segment":2,"confidence":16.46067415730337,"iterationTokens":2852,"asi":{"hypothesis":"Lifecycle-safe provider tests had small callbacks whose only purpose was assigning deferred handles or adapter fields; expression-bodied assignments preserve setup semantics while reducing test boilerplate"}}
{"run":338,"commit":"bb11a69","metric":9699,"metrics":{"loc":9699,"vitest":107,"eslint_scoped":1},"status":"keep","description":"Collapsed files settings test mutation callbacks","timestamp":1777369476756,"segment":2,"confidence":16.33426183844011,"iterationTokens":2241,"asi":{"hypothesis":"Some files-settings controller test service mocks only update the local uploads array; expression-bodied assignments preserve mock side effects while reducing boilerplate"}}
{"run":339,"commit":"429e89c","metric":9694,"metrics":{"loc":9694,"vitest":107,"eslint_scoped":1},"status":"keep","description":"Collapsed Deepgram browser deferred mock","timestamp":1777369495237,"segment":2,"confidence":16.316666666666666,"iterationTokens":1362,"asi":{"hypothesis":"The pending getUserMedia test only captures the Promise resolver; expression-bodied resolver assignment preserves deferred stream control while reducing setup boilerplate"}}
{"run":340,"commit":"b1689b2","metric":9692,"metrics":{"loc":9692,"vitest":107,"eslint_scoped":1},"status":"keep","description":"Collapsed native deferred resolver helper","timestamp":1777369516084,"segment":2,"confidence":16.19283746556474,"iterationTokens":1579,"asi":{"hypothesis":"The native Deepgram deferred test helper only captures a Promise resolver; expression-bodied resolver assignment preserves deferred control while removing block boilerplate"}}
{"run":341,"commit":"3d3e7c1","metric":9676,"metrics":{"loc":9676,"vitest":107,"eslint_scoped":1},"status":"keep","description":"Added requested ./autoresearch.sh benchmark wrapper and established its passing LOC result","timestamp":1777370153958,"segment":2,"confidence":16.236263736263737,"iterationTokens":1579,"asi":{"hypothesis":"Using the requested benchmark script should preserve formatted LOC plus TypeScript, scoped ESLint, and Vitest gates while giving autoresearch a stable command to run"}}
{"run":342,"commit":"wip","metric":9678,"metrics":{"loc":9678,"vitest":107,"eslint_scoped":1},"status":"discard","description":"Tried shared settings text style fragments, but spread constants increased LOC","timestamp":1777370179468,"segment":2,"confidence":16.147540983606557,"iterationTokens":10489,"asi":{"hypothesis":"Repeated settings hint/action text style properties could be factored into local constants to reduce duplication","rollback_reason":"The new style constants added more formatted lines than the duplicated inline style fields removed, increasing LOC from 9676 to 9678","next_action_hint":"Only factor style fragments when many full multiline blocks can share them, not a few one-line style objects"}}
{"run":343,"commit":"cf6cd0f","metric":9656,"metrics":{"loc":9656,"vitest":107,"eslint_scoped":1},"status":"keep","description":"Unified Deepgram adapter selection test doubles","timestamp":1777370205458,"segment":2,"confidence":16.168478260869566,"iterationTokens":5059,"asi":{"hypothesis":"Browser and native Deepgram test adapters had identical call-count behavior; a shared adapter class factory preserves platform-selection assertions while removing duplicate mock classes"}}
{"run":344,"commit":"b97cb7d","metric":9647,"metrics":{"loc":9647,"vitest":107,"eslint_scoped":1},"status":"keep","description":"Collapsed Deepgram adapter mock lifecycle methods","timestamp":1777370275173,"segment":2,"confidence":16.12972972972973,"iterationTokens":13815,"asi":{"hypothesis":"The shared Deepgram adapter test double lifecycle methods only increment counters; expression-bodied async properties preserve awaitability and call counting while reducing class method boilerplate"}}
{"run":345,"commit":"wip","metric":9632,"metrics":{"loc":9632,"vitest":0,"eslint_scoped":1},"status":"crash","description":"Tried shared STT provider mock factory but copied mutable mock state","timestamp":1777370308076,"segment":2,"confidence":16.043010752688172,"iterationTokens":5778,"asi":{"hypothesis":"Deepgram and Web Speech build-provider tests duplicate mock provider classes; a shared factory can reduce boilerplate","rollback_reason":"The factory returned a spread copy of mutable state, so test assignments to sttMocks.webSpeechStartError did not affect the closed-over state and startup failure assertions stopped rejecting","next_action_hint":"Retry with Object.assign(state, { classes }) so returned sttMocks preserves mutation identity"}}
{"run":346,"commit":"c35a8e4","metric":9631,"metrics":{"loc":9631,"vitest":107,"eslint_scoped":1},"status":"keep","description":"Shared build-provider STT mock class factory","timestamp":1777370324731,"segment":2,"confidence":15.831134564643799,"iterationTokens":3896,"asi":{"hypothesis":"Deepgram and Web Speech build-provider tests duplicate provider mocks with identical lifecycle and emit behavior; a shared class factory preserves mutable mock state and callbacks while removing duplicate classes"}}
{"run":347,"commit":"0955cc6","metric":9627,"metrics":{"loc":9627,"vitest":107,"eslint_scoped":1},"status":"keep","description":"Collapsed build-provider mock emit methods","timestamp":1777370345313,"segment":2,"confidence":15.564766839378239,"iterationTokens":1690,"asi":{"hypothesis":"Shared build-provider mock emit methods only forward to stored callbacks; expression-bodied properties preserve behavior while reducing method boilerplate"}}
{"run":348,"commit":"f56b87c","metric":9619,"metrics":{"loc":9619,"vitest":107,"eslint_scoped":1},"status":"keep","description":"Collapsed fake STT emit forwarding methods","timestamp":1777370363961,"segment":2,"confidence":15.48586118251928,"iterationTokens":1552,"asi":{"hypothesis":"Session runtime and lifecycle-safe fake STT providers have emit methods that only forward to stored callbacks; expression-bodied properties reduce repeated boilerplate without changing test behavior"}}
{"run":349,"commit":"d60da84","metric":9614,"metrics":{"loc":9614,"vitest":107,"eslint_scoped":1},"status":"keep","description":"Collapsed simple ingestion helper functions","timestamp":1777370399800,"segment":2,"confidence":15.392857142857142,"iterationTokens":4483,"asi":{"hypothesis":"Several ingestion helpers are pure single-expression normalizers; converting them to expression-bodied constants keeps the parsing behavior and type guards while trimming boilerplate"}}
{"run":350,"commit":"2630b21","metric":9611,"metrics":{"loc":9611,"vitest":107,"eslint_scoped":1},"status":"keep","description":"Collapsed simple helper wrappers","timestamp":1777370427764,"segment":2,"confidence":15.368956743002544,"iterationTokens":3903,"asi":{"hypothesis":"A handful of pure helpers only return a single expression; expression-bodied constants preserve behavior and make the simple transformations more direct"}}
{"run":351,"commit":"007b47c","metric":9603,"metrics":{"loc":9603,"vitest":107,"eslint_scoped":1},"status":"keep","description":"Collapsed more single-expression helpers","timestamp":1777370462965,"segment":2,"confidence":15.370558375634518,"iterationTokens":4384,"asi":{"hypothesis":"Several small production and test helpers only return one expression; expression-bodied constants keep the same contracts while reducing helper boilerplate"}}
{"run":352,"commit":"ff91342","metric":9601,"metrics":{"loc":9601,"vitest":107,"eslint_scoped":1},"status":"keep","description":"Collapsed multiline normalization helpers","timestamp":1777370487658,"segment":2,"confidence":15.538461538461538,"iterationTokens":3215,"asi":{"hypothesis":"Entity ID building and Homebrewery syntax stripping are pure return-only transformations; expression-bodied constants preserve their pipelines while removing wrapper boilerplate"}}
{"run":353,"commit":"3f7398e","metric":9596,"metrics":{"loc":9596,"vitest":107,"eslint_scoped":1},"status":"keep","description":"Collapsed native recording mock helpers","timestamp":1777370504688,"segment":2,"confidence":15.72538860103627,"iterationTokens":1931,"asi":{"hypothesis":"The native Deepgram recording mock has tiny counter methods and a two-tick flush helper; expression-bodied counter methods plus grouped promise flushing preserve test synchronization with less boilerplate"}}
{"run":354,"commit":"0ab0afa","metric":9584,"metrics":{"loc":9584,"vitest":107,"eslint_scoped":1},"status":"keep","description":"Collapsed browser capture mock forwarding methods","timestamp":1777370531651,"segment":2,"confidence":14.79126213592233,"iterationTokens":1930,"asi":{"hypothesis":"Browser Deepgram test doubles have several one-statement methods that only set state or forward events; expression-bodied fields preserve mock behavior while reducing boilerplate"}}
{"run":355,"commit":"a8f58a7","metric":9579,"metrics":{"loc":9579,"vitest":107,"eslint_scoped":1},"status":"keep","description":"Collapsed speech mock control callbacks","timestamp":1777370554532,"segment":2,"confidence":13.93607305936073,"iterationTokens":3279,"asi":{"hypothesis":"The E2E speech mock state exposes tiny control methods that only assign or forward events; expression-bodied callbacks preserve the page API while trimming mock boilerplate"}}
{"run":356,"commit":"ad7a3d3","metric":9575,"metrics":{"loc":9575,"vitest":107,"eslint_scoped":1},"status":"keep","description":"Collapsed OG screenshot speech mock methods","timestamp":1777370573928,"segment":2,"confidence":13.954337899543379,"iterationTokens":1275,"asi":{"hypothesis":"The OG screenshot SpeechRecognition mock start/abort methods only assign or forward onend; expression-bodied fields preserve the mock behavior with less boilerplate"}}
{"run":357,"commit":"9fa5b0f","metric":9563,"metrics":{"loc":9563,"vitest":107,"eslint_scoped":1},"status":"keep","description":"Collapsed STT delegation lifecycle methods","timestamp":1777370607301,"segment":2,"confidence":14.009132420091325,"iterationTokens":3570,"asi":{"hypothesis":"DeepgramProvider and LateEventSafeSTTProvider pause/resume/stop are pure delegations; expression-bodied instance fields preserve the public STTProvider contract while removing repetitive method wrappers"}}
{"run":358,"commit":"b92f9bb","metric":9551,"metrics":{"loc":9551,"vitest":107,"eslint_scoped":1},"status":"keep","description":"Collapsed simple session runtime command wrappers","timestamp":1777370622782,"segment":2,"confidence":14.06392694063927,"iterationTokens":1118,"asi":{"hypothesis":"Several SessionRuntime commands only set one field or forward to start/updateCards; expression-bodied instance fields preserve the command API while removing wrapper boilerplate"}}
{"run":359,"commit":"5f59c7a","metric":9549,"metrics":{"loc":9549,"vitest":107,"eslint_scoped":1},"status":"keep","description":"Collapsed files settings draft setters","timestamp":1777370636741,"segment":2,"confidence":14.073059360730594,"iterationTokens":926,"asi":{"hypothesis":"Files settings paste draft setters only resolve a string update into a snapshot patch; expression-bodied instance fields preserve setter behavior with less boilerplate"}}
{"run":360,"commit":"a41f063","metric":9544,"metrics":{"loc":9544,"vitest":107,"eslint_scoped":1},"status":"keep","description":"Collapsed storage settings forwarding helpers","timestamp":1777370662145,"segment":2,"confidence":14.25866050808314,"iterationTokens":4424,"asi":{"hypothesis":"Several app-data settings exports are single-expression factory/load/save wrappers; expression-bodied exports preserve the module API while reducing wrapper boilerplate"}}
{"run":361,"commit":"b1c404c","metric":9538,"metrics":{"loc":9538,"vitest":107,"eslint_scoped":1},"status":"keep","description":"Collapsed app data token predicate helpers","timestamp":1777370684571,"segment":2,"confidence":14.453271028037383,"iterationTokens":2107,"asi":{"hypothesis":"App data storage key and token predicates are pure expressions; exporting them as expression-bodied constants preserves callers while reducing boilerplate"}}
{"run":362,"commit":"725a951","metric":9532,"metrics":{"loc":9532,"vitest":107,"eslint_scoped":1},"status":"keep","description":"Collapsed small exported predicate helpers","timestamp":1777370717942,"segment":2,"confidence":14.549295774647888,"iterationTokens":2589,"asi":{"hypothesis":"Several exported helpers are pure one-expression predicates or transforms; expression-bodied named exports preserve imports while reducing wrapper boilerplate"}}
{"run":363,"commit":"41f8763","metric":9528,"metrics":{"loc":9528,"vitest":107,"eslint_scoped":1},"status":"keep","description":"Collapsed settings controller factories","timestamp":1777370738862,"segment":2,"confidence":14.63679245283019,"iterationTokens":965,"asi":{"hypothesis":"Voice and files settings controller factory exports only instantiate their default controllers; expression-bodied exports preserve factory seams while reducing boilerplate"}}
{"run":364,"commit":"74dabe4","metric":9526,"metrics":{"loc":9526,"vitest":107,"eslint_scoped":1},"status":"keep","description":"Collapsed entity bullet extraction exports","timestamp":1777370758954,"segment":2,"confidence":14.680851063829786,"iterationTokens":1192,"asi":{"hypothesis":"Entity card bullet extraction exports are pure return pipelines; expression-bodied exports preserve summary/detail derivation while removing function wrapper lines"}}
{"run":365,"commit":"d9dff34","metric":9522,"metrics":{"loc":9522,"vitest":107,"eslint_scoped":1},"status":"keep","description":"Collapsed uploaded-file mutation wrappers","timestamp":1777370787823,"segment":2,"confidence":14.734597156398104,"iterationTokens":3096,"asi":{"hypothesis":"Uploaded-file storage exports simply return mutation/read promises without awaiting; expression-bodied promise-returning exports preserve async behavior while trimming wrappers"}}
{"run":366,"commit":"4693cec","metric":9518,"metrics":{"loc":9518,"vitest":107,"eslint_scoped":1},"status":"keep","description":"Collapsed E2E speech event helpers","timestamp":1777370807430,"segment":2,"confidence":14.788598574821853,"iterationTokens":1585,"asi":{"hypothesis":"E2E speech error/end/count helpers only return page.evaluate promises; expression-bodied exports preserve caller await semantics while reducing wrapper boilerplate"}}
{"run":367,"commit":"06a69e6","metric":9517,"metrics":{"loc":9517,"vitest":107,"eslint_scoped":1},"status":"keep","description":"Collapsed STT settings load wrapper","timestamp":1777370835658,"segment":2,"confidence":14.82857142857143,"iterationTokens":1239,"asi":{"hypothesis":"loadSettings only awaits the stored voice settings and falls back to defaults; an expression-bodied async export preserves behavior while removing wrapper boilerplate"}}
{"run":368,"commit":"a5382b0","metric":9516,"metrics":{"loc":9516,"vitest":107,"eslint_scoped":1},"status":"keep","description":"Collapsed STT provider factory export","timestamp":1777370853799,"segment":2,"confidence":14.763033175355451,"iterationTokens":1071,"asi":{"hypothesis":"buildProvider is a pure factory wrapper around createLateEventSafeSTTProvider; expression-bodied export preserves provider selection while removing return boilerplate"}}
