{"run":50,"commit":"bc4753e","metric":10943,"metrics":{"eslint_scoped":1,"vitest":107},"status":"keep","description":"Shared screenshot-and-record helper in MCP E2E tests","timestamp":1777332729695,"segment":1,"confidence":3.875,"iterationTokens":5291,"asi":{"hypothesis":"MCP E2E tests repeatedly take a screenshot then push the same path into an array; a saveScreenshot helper removes duplication while preserving reporting"}}
{"run":51,"commit":"wip","metric":10945,"metrics":{"eslint_scoped":1,"vitest":107},"status":"discard","description":"Tried sharing MCP body text helper, but helper overhead increased LOC","timestamp":1777332766361,"segment":1,"confidence":3.9195402298850577,"iterationTokens":1690,"asi":{"hypothesis":"Repeated page.textContent('body') fallback calls in MCP tests could share a getBodyText helper","rollback_reason":"The helper line plus call sites ended up two lines worse than the repeated expression","next_action_hint":"Do not extract tiny repeated expressions unless they remove enough call-site ceremony or improve behavior"}}
{"run":52,"commit":"15996e9","metric":10939,"metrics":{"eslint_scoped":1,"vitest":107},"status":"keep","description":"Simplified ingested entity id assembly","timestamp":1777332797872,"segment":1,"confidence":3.9204545454545454,"iterationTokens":1620,"asi":{"hypothesis":"buildEntityId manually pushes optional parts; constructing the parts array directly and filtering absent values reduces branching while preserving id behavior"}}
{"run":53,"commit":"c1940b4","metric":10936,"metrics":{"eslint_scoped":1,"vitest":107},"status":"keep","description":"Compacted parsed markdown field return object","timestamp":1777332815569,"segment":1,"confidence":3.8241758241758244,"iterationTokens":966,"asi":{"hypothesis":"parseField returns a small two-property object; a single-line object literal removes unnecessary vertical space without logic changes"}}
{"run":54,"commit":"a5e0fe7","metric":10935,"metrics":{"eslint_scoped":1,"vitest":107},"status":"keep","description":"Inlined markdown heading block end calculation","timestamp":1777332837551,"segment":1,"confidence":3.7934782608695654,"iterationTokens":1048,"asi":{"hypothesis":"getHeadingBlocks only used the end offset once; inlining it into the slice removes a temporary without changing parsing"}}
{"run":55,"commit":"60a2539","metric":10932,"metrics":{"eslint_scoped":1,"vitest":107},"status":"keep","description":"Simplified non-empty string normalization","timestamp":1777332860876,"segment":1,"confidence":3.6288659793814433,"iterationTokens":972,"asi":{"hypothesis":"normalizeNonEmptyString can express its type guard and trim fallback directly, removing a temporary variable and blank line"}}
{"run":56,"commit":"e086f71","metric":10925,"metrics":{"eslint_scoped":1,"vitest":107},"status":"keep","description":"Generated SRD monster stat summary from label/value pairs","timestamp":1777332891195,"segment":1,"confidence":3.663265306122449,"iterationTokens":1701,"asi":{"hypothesis":"monsterToEntity repeated individual ability-score temporaries; mapping label/value pairs reduces repetition and preserves the summary format"}}
{"run":57,"commit":"wip","metric":10925,"metrics":{"eslint_scoped":1,"vitest":107},"status":"discard","description":"Tried dropping EntityDetailsModal StyleSheet wrapper, but LOC was unchanged","timestamp":1777332912286,"segment":1,"confidence":3.59,"iterationTokens":1107,"asi":{"hypothesis":"EntityDetailsModal styles might avoid StyleSheet.create like settings styles","rollback_reason":"Removing the import was offset by the required `as const` annotation, yielding no primary metric improvement","next_action_hint":"Only drop component StyleSheet wrappers when the file no longer needs the import and no const annotation is needed or other simplifications combine with it"}}
{"run":58,"commit":"fdf7c89","metric":10921,"metrics":{"eslint_scoped":1,"vitest":107},"status":"keep","description":"Inlined single-use entity details renderer","timestamp":1777332936583,"segment":1,"confidence":3.5588235294117645,"iterationTokens":1359,"asi":{"hypothesis":"EntityDetailsModal had a renderDetails helper used once; inlining the map at the render site removes indirection and a few lines without behavior changes"}}
{"run":59,"commit":"a4fe8ed","metric":10918,"metrics":{"eslint_scoped":1,"vitest":107},"status":"keep","description":"Inlined single-use SRD capitalize helper","timestamp":1777332958908,"segment":1,"confidence":3.519230769230769,"iterationTokens":1011,"asi":{"hypothesis":"The SRD capitalize helper was only used once for item rarity; inlining removes a single-use helper without changing output"}}
{"run":60,"commit":"bd03bd7","metric":10912,"metrics":{"eslint_scoped":1,"vitest":107},"status":"keep","description":"Inlined single-use upload parser helper","timestamp":1777332984966,"segment":1,"confidence":3.4604651162790696,"iterationTokens":1136,"asi":{"hypothesis":"FileUploadProvider.parseUpload was only used by load(); inlining it into flatMap removes helper indirection while preserving JSON parse warnings"}}
{"run":61,"commit":"06a54ff","metric":10901,"metrics":{"eslint_scoped":1,"vitest":107},"status":"keep","description":"Compacted file-upload storage seam wrappers","timestamp":1777333010023,"segment":1,"confidence":3.2735042735042734,"iterationTokens":1305,"asi":{"hypothesis":"The file-upload provider exports thin storage seam wrappers; one-line wrappers reduce boilerplate while preserving the async API"}}
{"run":62,"commit":"71d08d4","metric":10890,"metrics":{"eslint_scoped":1,"vitest":107},"status":"keep","description":"Compacted uploaded-file storage API wrappers","timestamp":1777333030069,"segment":1,"confidence":3.4260869565217393,"iterationTokens":1111,"asi":{"hypothesis":"The uploaded-file storage module exposes simple forwarding/mutation wrapper functions; concise definitions reduce boilerplate without API changes"}}
{"run":63,"commit":"25cc056","metric":10868,"metrics":{"eslint_scoped":1,"vitest":107},"status":"keep","description":"Compacted simple app-data core declarations","timestamp":1777333054353,"segment":1,"confidence":3.7142857142857144,"iterationTokens":2200,"asi":{"hypothesis":"App data core had several short forwarding guards and small constant/import lists spread over many lines; compacting them preserves behavior and lint"}}
{"run":64,"commit":"045193b","metric":10853,"metrics":{"eslint_scoped":1,"vitest":107},"status":"keep","description":"Compacted simple app-data settings helpers","timestamp":1777333093742,"segment":1,"confidence":3.8482142857142856,"iterationTokens":2015,"asi":{"hypothesis":"Several app-data settings helpers are thin one-return functions; concise definitions reduce boilerplate without changing normalization or persistence"}}
{"run":65,"commit":"4f95419","metric":10849,"metrics":{"eslint_scoped":1,"vitest":107},"status":"keep","description":"Compacted data-source settings merge return","timestamp":1777333115395,"segment":1,"confidence":3.8839285714285716,"iterationTokens":878,"asi":{"hypothesis":"mergeDataSourceSettings returns a small object assembled from defaults, patch, and sources; a single-line return removes vertical boilerplate"}}
{"run":66,"commit":"3667139","metric":10832,"metrics":{"eslint_scoped":1,"vitest":107},"status":"keep","description":"Compacted simple exported one-return helpers","timestamp":1777333188931,"segment":1,"confidence":4.017777777777778,"iterationTokens":2646,"asi":{"hypothesis":"Several exported utility functions are pure single-return wrappers; concise definitions remove boilerplate while preserving their public API and tests"}}
{"run":67,"commit":"e7053cc","metric":10828,"metrics":{"eslint_scoped":1,"vitest":107},"status":"keep","description":"Compacted simple card-stack helpers","timestamp":1777333209539,"segment":1,"confidence":4.1454545454545455,"iterationTokens":970,"asi":{"hypothesis":"Card-stack helper functions with a single return can be concise one-liners without changing stack behavior"}}
{"run":68,"commit":"135ae94","metric":10792,"metrics":{"eslint_scoped":1,"vitest":107},"status":"keep","description":"Compacted internal single-return helpers","timestamp":1777333305870,"segment":1,"confidence":4.6635071090047395,"iterationTokens":627,"asi":{"hypothesis":"Many remaining internal helper functions had one return statement; compacting them reduces vertical boilerplate while full typecheck/lint/tests protect behavior"}}
{"run":69,"commit":"494a15d","metric":10784,"metrics":{"eslint_scoped":1,"vitest":107},"status":"keep","description":"Compacted remaining simple one-return functions","timestamp":1777333342241,"segment":1,"confidence":4.716981132075472,"iterationTokens":1553,"asi":{"hypothesis":"The remaining one-return utility functions can be expressed concisely without changing APIs or behavior"}}
{"run":70,"commit":"105aa34","metric":10777,"metrics":{"eslint_scoped":1,"vitest":107},"status":"keep","description":"Shared SessionRuntime card update guard","timestamp":1777333380077,"segment":1,"confidence":4.828571428571428,"iterationTokens":4058,"asi":{"hypothesis":"pin/unpin/dismiss repeated the same changed-card guard; a private updateCards helper reduces duplication while preserving stack behavior"}}
{"run":71,"commit":"f51776d","metric":10773,"metrics":{"eslint_scoped":1,"vitest":107},"status":"keep","description":"Compacted tiny SessionRuntime guard methods","timestamp":1777333413627,"segment":1,"confidence":4.913461538461538,"iterationTokens":1394,"asi":{"hypothesis":"Tiny SessionRuntime guard methods can be expressed on one line without changing control flow, reducing boilerplate"}}
{"run":72,"commit":"b412212","metric":10752,"metrics":{"eslint_scoped":1,"vitest":107},"status":"keep","description":"Compacted MarkdownProvider and STT lifecycle helpers","timestamp":1777333465167,"segment":1,"confidence":5.018867924528302,"iterationTokens":3210,"asi":{"hypothesis":"MarkdownProvider duplicated constructor field assignment and several lifecycle-safe STT helpers are tiny; parameter properties and one-liners reduce ceremony without behavior changes"}}
{"run":73,"commit":"d5699fe","metric":10741,"metrics":{"eslint_scoped":1,"vitest":107},"status":"keep","description":"Compacted small settings/STT methods","timestamp":1777333509476,"segment":1,"confidence":5.027777777777778,"iterationTokens":2292,"asi":{"hypothesis":"Several settings controller and STT methods contain only one or two simple statements; compacting them trims boilerplate while preserving behavior"}}
{"run":74,"commit":"c8ac254","metric":10739,"metrics":{"eslint_scoped":1,"vitest":107},"status":"keep","description":"Compacted native capture start wrapper","timestamp":1777333536011,"segment":1,"confidence":4.932126696832579,"iterationTokens":1101,"asi":{"hypothesis":"Deepgram native startNativeCapture is a single enqueue wrapper and can be a one-liner without changing serialization behavior"}}
{"run":75,"commit":"8e3a6a5","metric":10737,"metrics":{"eslint_scoped":1,"vitest":107},"status":"keep","description":"Removed unused upload mutation wait re-export","timestamp":1777333568572,"segment":1,"confidence":4.756521739130434,"iterationTokens":1581,"asi":{"hypothesis":"file-upload provider re-exported a waitForUploadMutations wrapper that no app or tests used; deleting dead seam code preserves functionality"}}
{"run":76,"commit":"ec81230","metric":10734,"metrics":{"eslint_scoped":1,"vitest":107},"status":"keep","description":"Removed unused context/provider key re-exports","timestamp":1777333629862,"segment":1,"confidence":4.741379310344827,"iterationTokens":3739,"asi":{"hypothesis":"Several modules re-exported storage keys that no code imported; deleting these dead re-exports reduces API surface without changing behavior"}}
{"run":77,"commit":"31496cc","metric":10720,"metrics":{"eslint_scoped":1,"vitest":107},"status":"keep","description":"Removed unused session helper/provider type re-exports","timestamp":1777333693022,"segment":1,"confidence":4.661157024793388,"iterationTokens":3005,"asi":{"hypothesis":"Several re-export barrels exposed symbols that no code imports; removing them shrinks API surface while typecheck confirms no consumers"}}
{"run":78,"commit":"wip","metric":10720,"metrics":{"eslint_scoped":1,"vitest":107},"status":"discard","description":"Tried removing CARD_SIZES re-export, but direct import offset the saved line","timestamp":1777333719941,"segment":1,"confidence":4.6419753086419755,"iterationTokens":990,"asi":{"hypothesis":"DisplaySection could import CARD_SIZES directly and ui-settings could stop re-exporting it","rollback_reason":"The import split added the same number of lines as the re-export removal, so primary LOC was unchanged","next_action_hint":"Only remove re-exports when consumers can avoid adding equivalent import lines or when multiple unused exports vanish together"}}
{"run":79,"commit":"d21bf42","metric":10703,"metrics":{"eslint_scoped":1,"vitest":107},"status":"keep","description":"Compacted files settings controller boilerplate","timestamp":1777333752667,"segment":1,"confidence":4.762295081967213,"iterationTokens":3975,"asi":{"hypothesis":"Files settings controller has several simple lifecycle/snapshot/factory helpers and a web confirm guard that can be compacted without changing behavior"}}
{"run":80,"commit":"1dc98c3","metric":10684,"metrics":{"eslint_scoped":1,"vitest":107},"status":"keep","description":"Compacted voice settings controller boilerplate","timestamp":1777333787839,"segment":1,"confidence":4.761904761904762,"iterationTokens":2571,"asi":{"hypothesis":"Voice settings controller has simple import, reset/dispose/snapshot/factory boilerplate that can be compacted while retaining behavior"}}
{"run":81,"commit":"81a8548","metric":10658,"metrics":{"eslint_scoped":1,"vitest":107},"status":"keep","description":"Compacted several multi-line imports","timestamp":1777333845687,"segment":1,"confidence":4.778625954198473,"iterationTokens":2262,"asi":{"hypothesis":"Several imports with a handful of symbols were spread over many lines; compact one-line imports reduce boilerplate while lint remains clean"}}
{"run":82,"commit":"c9539a4","metric":10608,"metrics":{"eslint_scoped":1,"vitest":107},"status":"keep","description":"Compacted E2E helper imports","timestamp":1777333888523,"segment":1,"confidence":4.970588235294118,"iterationTokens":1817,"asi":{"hypothesis":"E2E specs had multi-line helper imports with few symbols; one-line imports reduce boilerplate while lint/typecheck/tests pass"}}
{"run":83,"commit":"fb10028","metric":10588,"metrics":{"eslint_scoped":1,"vitest":107},"status":"keep","description":"Compacted context/component/test import blocks","timestamp":1777333943197,"segment":1,"confidence":4.9361702127659575,"iterationTokens":2229,"asi":{"hypothesis":"More small import/export blocks can be made one-line to reduce boilerplate without changing behavior"}}
{"run":84,"commit":"1ad53de","metric":10562,"metrics":{"eslint_scoped":1,"vitest":107},"status":"keep","description":"Compacted STT import blocks","timestamp":1777333992345,"segment":1,"confidence":5.084507042253521,"iterationTokens":2107,"asi":{"hypothesis":"STT modules and tests had multi-line imports that remain readable on one line and reduce boilerplate without behavior changes"}}
{"run":85,"commit":"4e9bc87","metric":10548,"metrics":{"eslint_scoped":1,"vitest":107},"status":"keep","description":"Compacted remaining small settings/provider import blocks","timestamp":1777334046051,"segment":1,"confidence":5.006802721088436,"iterationTokens":1804,"asi":{"hypothesis":"Remaining small settings/provider import blocks can be one-line without hurting lint or behavior"}}
{"run":86,"commit":"6eb86f9","metric":10508,"metrics":{"eslint_scoped":1,"vitest":107},"status":"keep","description":"Compacted app-data barrel exports","timestamp":1777334080088,"segment":1,"confidence":5.315068493150685,"iterationTokens":1836,"asi":{"hypothesis":"The app-data barrel consisted mostly of long re-export lists; compacting them reduces boilerplate while preserving the same public exports"}}
{"run":87,"commit":"acc50df","metric":10481,"metrics":{"eslint_scoped":1,"vitest":107},"status":"keep","description":"Compacted app-data test import lists","timestamp":1777334110243,"segment":1,"confidence":5.537931034482758,"iterationTokens":1676,"asi":{"hypothesis":"The app-data storage test had long multi-line import lists; one-line imports reduce boilerplate while keeping tests and lint green"}}
{"run":88,"commit":"e26cc2e","metric":10470,"metrics":{"eslint_scoped":1,"vitest":107},"status":"keep","description":"Compacted SessionRuntime test helpers","timestamp":1777334193805,"segment":1,"confidence":5.201277955271565,"iterationTokens":7349,"asi":{"hypothesis":"SessionRuntime test helper entity factory and fake detector method are simple enough to be concise one-liners while preserving test behavior"}}
{"run":89,"commit":"14b1dc2","metric":10466,"metrics":{"eslint_scoped":1,"vitest":107},"status":"keep","description":"Compacted uploaded-file factory object","timestamp":1777334219334,"segment":1,"confidence":5.080745341614906,"iterationTokens":1718,"asi":{"hypothesis":"UploadedFile factory returns a small object literal that can be single-line without behavior change"}}
{"run":90,"commit":"e7afea6","metric":10463,"metrics":{"eslint_scoped":1,"vitest":107},"status":"keep","description":"Inlined card duplicate check","timestamp":1777334258508,"segment":1,"confidence":5.067901234567901,"iterationTokens":2329,"asi":{"hypothesis":"buildCardIdSet was only used once in addCard; using cards.some directly removes the helper while preserving duplicate prevention"}}
{"run":91,"commit":"d8fe478","metric":10460,"metrics":{"eslint_scoped":1,"vitest":107},"status":"keep","description":"Simplified card extraction helper","timestamp":1777334280686,"segment":1,"confidence":5.0552147239263805,"iterationTokens":1033,"asi":{"hypothesis":"extractCard can return the found card and filtered rest via a single conditional expression, removing temporary/guard lines while preserving behavior"}}
{"run":92,"commit":"d466f60","metric":10416,"metrics":{"eslint_scoped":1,"vitest":107},"status":"keep","description":"Compacted small entity/layout interface declarations","timestamp":1777334334312,"segment":1,"confidence":5.244712990936556,"iterationTokens":2834,"asi":{"hypothesis":"Small structural interfaces in entity ingestion/index and reference-card-layout can be one-line declarations, reducing boilerplate while keeping type contracts unchanged"}}
{"run":93,"commit":"4819d7f","metric":10400,"metrics":{"eslint_scoped":1,"vitest":107},"status":"keep","description":"Compacted small entity-card presentation interfaces","timestamp":1777334371389,"segment":1,"confidence":5.261904761904762,"iterationTokens":1613,"asi":{"hypothesis":"Small action/input presentation interfaces can be one-line declarations, preserving types while cutting boilerplate"}}
{"run":94,"commit":"c644845","metric":10388,"metrics":{"eslint_scoped":1,"vitest":107},"status":"keep","description":"Compacted entity-card presentation shape interface","timestamp":1777334401315,"segment":1,"confidence":5.3017751479289945,"iterationTokens":1015,"asi":{"hypothesis":"The EntityCardPresentation type is a straightforward data shape and can be represented as a one-line interface without changing runtime behavior"}}
{"run":95,"commit":"db1beea","metric":10362,"metrics":{"eslint_scoped":1,"vitest":107},"status":"keep","description":"Compacted small option/data interfaces","timestamp":1777334471902,"segment":1,"confidence":5.423529411764706,"iterationTokens":2150,"asi":{"hypothesis":"Small interfaces in runtime, storage, settings, STT, and SRD modules can be one-line declarations while retaining identical type contracts"}}
{"run":96,"commit":"b2b49cb","metric":10333,"metrics":{"eslint_scoped":1,"vitest":107},"status":"keep","description":"Compacted session state/context interfaces","timestamp":1777334508503,"segment":1,"confidence":5.3277310924369745,"iterationTokens":1603,"asi":{"hypothesis":"Session state/context interfaces are structural type declarations that can be one-line without changing runtime behavior or public types"}}
{"run":97,"commit":"d5f5927","metric":10296,"metrics":{"eslint_scoped":1,"vitest":107},"status":"keep","description":"Compacted settings section prop interfaces","timestamp":1777334544594,"segment":1,"confidence":5.283422459893048,"iterationTokens":2123,"asi":{"hypothesis":"Settings section prop interfaces are simple structural declarations; one-line interfaces retain type safety while reducing boilerplate"}}
{"run":98,"commit":"0d3c3c2","metric":10279,"metrics":{"eslint_scoped":1,"vitest":107},"status":"keep","description":"Compacted files settings data/option interfaces","timestamp":1777334571183,"segment":1,"confidence":5.275590551181103,"iterationTokens":1173,"asi":{"hypothesis":"Files settings snapshot/options interfaces are structural data declarations that can be compacted without changing behavior"}}
{"run":99,"commit":"2e917ed","metric":10267,"metrics":{"eslint_scoped":1,"vitest":107},"status":"keep","description":"Compacted files settings controller interface","timestamp":1777334599336,"segment":1,"confidence":5.2153846153846155,"iterationTokens":1064,"asi":{"hypothesis":"The files settings controller interface is an API contract with method signatures only; compacting to one line preserves type checking and reduces boilerplate"}}
{"run":100,"commit":"d2181af","metric":10254,"metrics":{"eslint_scoped":1,"vitest":107},"status":"keep","description":"Compacted voice settings controller interfaces","timestamp":1777334623560,"segment":1,"confidence":5.268542199488491,"iterationTokens":1119,"asi":{"hypothesis":"Voice settings option/controller interfaces contain method/property signatures only and can be one-line type declarations without runtime changes"}}
