{"run":369,"commit":"a0a70b6","metric":9515,"metrics":{"loc":9515,"vitest":107,"eslint_scoped":1},"status":"keep","description":"Collapsed data source settings load wrapper","timestamp":1777370868051,"segment":2,"confidence":14.69811320754717,"iterationTokens":891,"asi":{"hypothesis":"loadDataSourceSettings only delegates to the shared JSON loader with a normalizer; expression-bodied export preserves settings loading while trimming wrapper boilerplate"}}
{"run":370,"commit":"aa23927","metric":9513,"metrics":{"loc":9513,"vitest":107,"eslint_scoped":1},"status":"keep","description":"Collapsed entity string normalization exports","timestamp":1777370887024,"segment":2,"confidence":14.604215456674472,"iterationTokens":1356,"asi":{"hypothesis":"slugify and stripHtml are pure string normalization pipelines; expression-bodied exports preserve behavior while removing function wrapper boilerplate"}}
{"run":371,"commit":"80e23ab","metric":9512,"metrics":{"loc":9512,"vitest":107,"eslint_scoped":1},"status":"keep","description":"Collapsed type accent lookup helper","timestamp":1777370915246,"segment":2,"confidence":14.506976744186046,"iterationTokens":1617,"asi":{"hypothesis":"typeAccent is a pure lookup from entity type to palette color; an expression-bodied export preserves the mapping while removing return wrapper boilerplate"}}
{"run":372,"commit":"3422823","metric":9510,"metrics":{"loc":9510,"vitest":107,"eslint_scoped":1},"status":"keep","description":"Collapsed SettingsInput component wrapper","timestamp":1777370942033,"segment":2,"confidence":14.652582159624414,"iterationTokens":2824,"asi":{"hypothesis":"SettingsInput is a stateless component that only returns a TextInput with shared props; expression-bodied component export preserves rendering while removing return wrapper boilerplate"}}
{"run":373,"commit":"779801d","metric":9504,"metrics":{"loc":9504,"vitest":107,"eslint_scoped":1},"status":"keep","description":"Collapsed stateless settings renderer components","timestamp":1777370983375,"segment":2,"confidence":14.819905213270141,"iterationTokens":5304,"asi":{"hypothesis":"DisplaySection and VoiceSection are stateless render-only components; expression-bodied component exports preserve JSX output while removing return wrapper boilerplate"}}
{"run":374,"commit":"wip","metric":9504,"metrics":{"loc":9504,"vitest":107,"eslint_scoped":1},"status":"discard","description":"Tried removing default React imports, but LOC was unchanged","timestamp":1777371018528,"segment":2,"confidence":15.033653846153847,"iterationTokens":2431,"asi":{"hypothesis":"Modern JSX transform may not need default React imports, so named-only imports could simplify files","rollback_reason":"Removing default React specifiers did not reduce formatted LOC because each import remained a single line","next_action_hint":"Do not pursue import-specifier-only cleanup for LOC unless it removes whole import lines or unused imported modules"}}
{"run":375,"commit":"a0dbe07","metric":9502,"metrics":{"loc":9502,"vitest":107,"eslint_scoped":1},"status":"keep","description":"Collapsed entity card test factory","timestamp":1777371043004,"segment":2,"confidence":15.263414634146342,"iterationTokens":1666,"asi":{"hypothesis":"The entity card presentation test factory only returns a CardState literal; an expression-bodied factory preserves test setup while reducing wrapper boilerplate"}}
{"run":376,"commit":"wip","metric":9504,"metrics":{"loc":9504,"vitest":107,"eslint_scoped":1},"status":"discard","description":"Tried expression-bodied MCP test result factory, but formatting increased LOC","timestamp":1777371069695,"segment":2,"confidence":15.451851851851853,"iterationTokens":1423,"asi":{"hypothesis":"MCP testResult returns a simple object and could be expression-bodied","rollback_reason":"Prettier expanded the returned object over multiple lines, increasing LOC from 9502 to 9504","next_action_hint":"Avoid expression-bodied object factories when the object literal does not remain one line"}}
{"run":377,"commit":"5dcb097","metric":9498,"metrics":{"loc":9498,"vitest":107,"eslint_scoped":1},"status":"keep","description":"Shared empty native Deepgram transcript fixture","timestamp":1777371097293,"segment":2,"confidence":15.665,"iterationTokens":1736,"asi":{"hypothesis":"Native Deepgram tests repeat the same empty transcript JSON fixture; naming the fixture removes duplicate response bodies while preserving upload mock behavior"}}
{"run":378,"commit":"ae7c714","metric":9494,"metrics":{"loc":9494,"vitest":107,"eslint_scoped":1},"status":"keep","description":"Grouped app storage key recognition assertions","timestamp":1777371124691,"segment":2,"confidence":15.529702970297029,"iterationTokens":3364,"asi":{"hypothesis":"App storage key recognition tests repeat identical true assertions; grouping the true cases into one loop preserves coverage while reducing assertion boilerplate"}}
{"run":379,"commit":"5cd17e0","metric":9488,"metrics":{"loc":9488,"vitest":107,"eslint_scoped":1},"status":"keep","description":"Simplified detector positive assertions","timestamp":1777371158572,"segment":2,"confidence":15.406862745098039,"iterationTokens":2810,"asi":{"hypothesis":"Detector positive tests separately asserted non-empty results and expected names; asserting the expected name is contained covers both success conditions with less assertion boilerplate"}}
{"run":380,"commit":"55cb048","metric":9485,"metrics":{"loc":9485,"vitest":107,"eslint_scoped":1},"status":"keep","description":"Inlined detector empty-result assertions","timestamp":1777371179762,"segment":2,"confidence":15.383863080684597,"iterationTokens":1023,"asi":{"hypothesis":"Detector negative tests create temporary result variables only to assert emptiness; direct toHaveLength assertions preserve intent while reducing setup noise"}}
{"run":381,"commit":"96533c6","metric":9483,"metrics":{"loc":9483,"vitest":107,"eslint_scoped":1},"status":"keep","description":"Simplified detector dedupe assertion","timestamp":1777371204996,"segment":2,"confidence":15.35609756097561,"iterationTokens":1681,"asi":{"hypothesis":"The detector dedupe test can assert the complete resulting name list instead of separate length and first-item assertions, preserving coverage with less boilerplate"}}
{"run":382,"commit":"1bc149d","metric":9481,"metrics":{"loc":9481,"vitest":107,"eslint_scoped":1},"status":"keep","description":"Inlined session-controls speech count assertions","timestamp":1777371230585,"segment":2,"confidence":15.365853658536585,"iterationTokens":1971,"asi":{"hypothesis":"Session-controls E2E tests only store speech start counts to assert them immediately; inlining the awaited helper preserves behavior while reducing temporary-variable noise"}}
{"run":383,"commit":"370ec5d","metric":9480,"metrics":{"loc":9480,"vitest":107,"eslint_scoped":1},"status":"keep","description":"Inlined edge-case speech count assertion","timestamp":1777371259218,"segment":2,"confidence":15.370731707317074,"iterationTokens":1141,"asi":{"hypothesis":"The stale-callback E2E test only stores the post-callback speech count to compare it immediately; inlining the awaited value preserves the regression assertion with less noise"}}
{"run":384,"commit":"549964c","metric":9478,"metrics":{"loc":9478,"vitest":107,"eslint_scoped":1},"status":"keep","description":"Inlined markdown provider load assertion","timestamp":1777371296003,"segment":2,"confidence":15.195180722891566,"iterationTokens":1839,"asi":{"hypothesis":"The markdown provider test only stores loaded entities to assert the full array; using resolves.toEqual preserves the async assertion while removing the temporary variable"}}
{"run":385,"commit":"wip","metric":9478,"metrics":{"loc":9478,"vitest":107,"eslint_scoped":1},"status":"discard","description":"Tried inlining Google Docs provider load assertion, but LOC was unchanged","timestamp":1777371318283,"segment":2,"confidence":15.158653846153847,"iterationTokens":1307,"asi":{"hypothesis":"The Google Docs provider test stores loaded entities only to assert identity with the ingestion result","rollback_reason":"Prettier wrapped the resolves.toBe assertion over enough lines that removing the temporary variable did not improve LOC","next_action_hint":"Keep the clearer local variable for multi-line async identity assertions unless combined with a broader test simplification"}}
{"run":386,"commit":"5ddd5f2","metric":9476,"metrics":{"loc":9476,"vitest":107,"eslint_scoped":1},"status":"keep","description":"Inlined app data reset result assertion","timestamp":1777371340032,"segment":2,"confidence":14.91725768321513,"iterationTokens":1126,"asi":{"hypothesis":"The app data reset test only stores the removed key list to sort and assert it; inlining the awaited result preserves the assertion while reducing temporary-variable noise"}}
{"run":387,"commit":"a8f47b1","metric":9475,"metrics":{"loc":9475,"vitest":107,"eslint_scoped":1},"status":"keep","description":"Inlined provider test collection assertions","timestamp":1777371378990,"segment":2,"confidence":14.679069767441861,"iterationTokens":2588,"asi":{"hypothesis":"Some provider tests only store loaded collections to immediately map and assert names; inlining the awaited collections preserves assertions while reducing temporary-variable noise"}}
{"run":388,"commit":"wip","metric":9477,"metrics":{"loc":9477,"vitest":107,"eslint_scoped":1},"status":"discard","description":"Tried shared responsive card bounding-box helper, but LOC increased","timestamp":1777371420765,"segment":2,"confidence":14.74766355140187,"iterationTokens":4112,"asi":{"hypothesis":"Responsive UI tests repeat entity-card boundingBox locators and could share a cardBox helper","rollback_reason":"Adding the helper cost more formatted lines than the shortened call sites saved, increasing LOC from 9476 to 9477","next_action_hint":"Only extract E2E locator helpers when repeated enough times or when they also remove assertions/control flow"}}
{"run":389,"commit":"836ba4c","metric":9469,"metrics":{"loc":9469,"vitest":107,"eslint_scoped":1},"status":"keep","description":"Grouped Deepgram adapter mock assertions","timestamp":1777371461119,"segment":2,"confidence":14.77570093457944,"iterationTokens":2315,"asi":{"hypothesis":"Deepgram adapter selection tests assert multiple fields on the same mock instances; grouped toMatchObject assertions preserve checked fields while reducing repetitive indexing assertions"}}
{"run":390,"commit":"e3be061","metric":9466,"metrics":{"loc":9466,"vitest":107,"eslint_scoped":1},"status":"keep","description":"Grouped session runtime provider call assertions","timestamp":1777371494267,"segment":2,"confidence":14.720930232558139,"iterationTokens":3125,"asi":{"hypothesis":"Session runtime failure tests assert multiple call counters on the same fake providers; grouped object assertions preserve checked counters while reducing repetitive property assertions"}}
{"run":391,"commit":"ded364b","metric":9465,"metrics":{"loc":9465,"vitest":107,"eslint_scoped":1},"status":"keep","description":"Removed unused file-system mock default export","timestamp":1777371534207,"segment":2,"confidence":14.657407407407407,"iterationTokens":3607,"asi":{"hypothesis":"The native Deepgram tests mock expo-file-system/legacy named exports only; dropping the unused default mock export preserves imports while removing dead mock shape"}}
{"run":392,"commit":"wip","metric":9461,"metrics":{"loc":9461,"vitest":0,"eslint_scoped":0},"status":"crash","description":"Tried promise-returning storage wait helpers but lost void typing","timestamp":1777371566323,"segment":2,"confidence":14.589861751152073,"iterationTokens":1512,"asi":{"hypothesis":"Storage wait helpers only await queue catch handlers and could return those promises directly","rollback_reason":"The queues are Promise<unknown>, so returning catch() directly violates the exported Promise<void> type even though runtime behavior is similar","next_action_hint":"Retry with a typed terminal .then(() => undefined) only if it still reduces formatted LOC"}}
{"run":393,"commit":"b152cbd","metric":9462,"metrics":{"loc":9462,"vitest":107,"eslint_scoped":1},"status":"keep","description":"Collapsed typed storage wait helpers","timestamp":1777371619069,"segment":2,"confidence":14.470319634703197,"iterationTokens":870,"asi":{"hypothesis":"Storage wait helpers can return typed queue-settling promises directly; adding a terminal then keeps the Promise<void> contract while reducing async wrapper boilerplate"}}
{"run":394,"commit":"61f10d9","metric":9454,"metrics":{"loc":9454,"vitest":107,"eslint_scoped":1},"status":"keep","description":"Table-driven detector empty-result cases","timestamp":1777371676113,"segment":2,"confidence":14.375565610859729,"iterationTokens":6151,"asi":{"hypothesis":"Detector empty-result tests share identical assertion structure across short, unknown, and empty transcripts; table-driving the cases preserves coverage and test count while removing repetition"}}
{"run":395,"commit":"4cd7653","metric":9450,"metrics":{"loc":9450,"vitest":107,"eslint_scoped":1},"status":"keep","description":"Table-driven detector positive cases","timestamp":1777371706103,"segment":2,"confidence":14.26457399103139,"iterationTokens":1395,"asi":{"hypothesis":"Detector positive cases share the same input-to-expected-name assertion shape; table-driving exact, alias, and multi-word cases preserves test count while removing repeated test bodies"}}
{"run":396,"commit":"4823ec3","metric":9446,"metrics":{"loc":9446,"vitest":107,"eslint_scoped":1},"status":"keep","description":"Shared session runtime snapshot fields in assertions","timestamp":1777371760303,"segment":2,"confidence":14.155555555555555,"iterationTokens":2942,"asi":{"hypothesis":"The card-stack runtime test repeatedly reads the same snapshot for cards and recent detections; destructuring once preserves assertions while removing repeated getSnapshot chains"}}
{"run":397,"commit":"wip","metric":9447,"metrics":{"loc":9447,"vitest":107,"eslint_scoped":1},"status":"discard","description":"Tried shared session-runtime cardIds test helper, but helper overhead increased LOC","timestamp":1777371803260,"segment":2,"confidence":14.0929203539823,"iterationTokens":1786,"asi":{"hypothesis":"Several SessionRuntime tests repeat card ID mapping from the snapshot and could share a helper","rollback_reason":"The helper declaration cost more formatted lines than the shortened assertions saved, increasing LOC from 9446 to 9447","next_action_hint":"Only add test mapping helpers when there are more repeated call sites or when they replace larger chains"}}
{"run":398,"commit":"6f97b00","metric":9442,"metrics":{"loc":9442,"vitest":107,"eslint_scoped":1},"status":"keep","description":"Collapsed simple session fake STT counters","timestamp":1777371824317,"segment":2,"confidence":14.110619469026549,"iterationTokens":1040,"asi":{"hypothesis":"FakeSTTProvider pause and stop methods only increment counters; expression-bodied async fields preserve awaitability while reducing method boilerplate"}}
{"run":399,"commit":"3f56ad3","metric":9440,"metrics":{"loc":9440,"vitest":107,"eslint_scoped":1},"status":"keep","description":"Collapsed lifecycle fake stop counter","timestamp":1777371847216,"segment":2,"confidence":14.05726872246696,"iterationTokens":812,"asi":{"hypothesis":"The lifecycle-safe provider fake stop method only increments a counter; an expression-bodied async field preserves awaitability while reducing method boilerplate"}}
{"run":400,"commit":"f235d31","metric":9438,"metrics":{"loc":9438,"vitest":107,"eslint_scoped":1},"status":"keep","description":"Collapsed build-provider mock start failure path","timestamp":1777371877121,"segment":2,"confidence":13.529661016949152,"iterationTokens":1014,"asi":{"hypothesis":"The shared build-provider mock start method only resolves or rejects based on configured error state; returning the appropriate promise preserves async failure behavior while reducing method boilerplate"}}
{"run":401,"commit":"dc7753f","metric":9432,"metrics":{"loc":9432,"vitest":107,"eslint_scoped":1},"status":"keep","description":"Collapsed fake STT start/resume promise paths","timestamp":1777371898522,"segment":2,"confidence":13.329166666666667,"iterationTokens":1009,"asi":{"hypothesis":"FakeSTTProvider start and resume only increment counters then either resolve or reject configured errors; expression-bodied promise returns preserve async semantics while reducing method boilerplate"}}
{"run":402,"commit":"aa4bf21","metric":9431,"metrics":{"loc":9431,"vitest":107,"eslint_scoped":1},"status":"keep","description":"Collapsed lifecycle fake start promise path","timestamp":1777371927525,"segment":2,"confidence":13.141683778234086,"iterationTokens":1195,"asi":{"hypothesis":"FakeCaptureAdapter start only increments a counter and returns either configured rejection, configured startup promise, or a resolved promise; expression-bodied return preserves behavior with less boilerplate"}}
{"run":403,"commit":"31d4660","metric":9429,"metrics":{"loc":9429,"vitest":107,"eslint_scoped":1},"status":"keep","description":"Collapsed native prepare mock promise path","timestamp":1777371955465,"segment":2,"confidence":12.963562753036438,"iterationTokens":1053,"asi":{"hypothesis":"MockRecording prepareToRecordAsync only waits for an optional deferred promise; returning the optional promise or a resolved promise preserves async behavior while reducing boilerplate"}}
{"run":404,"commit":"f81a874","metric":9420,"metrics":{"loc":9420,"vitest":107,"eslint_scoped":1},"status":"keep","description":"Collapsed browser recorder state-transition mocks","timestamp":1777371977062,"segment":2,"confidence":12.61689587426326,"iterationTokens":972,"asi":{"hypothesis":"Browser Deepgram recorder/socket mocks have tiny state-transition methods; expression-bodied fields preserve state mutations and callbacks while reducing method boilerplate"}}
{"run":405,"commit":"ea1dc51","metric":9419,"metrics":{"loc":9419,"vitest":107,"eslint_scoped":1},"status":"keep","description":"Collapsed browser socket close mock","timestamp":1777371998383,"segment":2,"confidence":12.259541984732824,"iterationTokens":858,"asi":{"hypothesis":"The mock WebSocket close method only records close state and emits a close event; expression-bodied state transition preserves mock behavior while trimming boilerplate"}}
{"run":406,"commit":"86a51d2","metric":9416,"metrics":{"loc":9416,"vitest":107,"eslint_scoped":1},"status":"keep","description":"Removed unused Deepgram mock constructor rest args","timestamp":1777372026416,"segment":2,"confidence":12.247619047619047,"iterationTokens":1430,"asi":{"hypothesis":"Deepgram adapter-selection mocks only inspect the API key and ignore transcript/error constructor arguments; removing explicit unused rest parameters preserves JavaScript call behavior while reducing mock boilerplate"}}
{"run":407,"commit":"91340a7","metric":9413,"metrics":{"loc":9413,"vitest":107,"eslint_scoped":1},"status":"keep","description":"Removed unused MediaRecorder mock constructor args","timestamp":1777372055717,"segment":2,"confidence":12.23574144486692,"iterationTokens":991,"asi":{"hypothesis":"The browser MediaRecorder mock never reads its stream/options constructor arguments; omitting them preserves extra-argument JavaScript construction while reducing unused mock state"}}
{"run":408,"commit":"6002f16","metric":9407,"metrics":{"loc":9407,"vitest":107,"eslint_scoped":1},"status":"keep","description":"Grouped Deepgram mock counter type fields","timestamp":1777372098122,"segment":2,"confidence":12.212121212121213,"iterationTokens":1670,"asi":{"hypothesis":"The Deepgram mock adapter type repeats four numeric lifecycle counter fields; using a Record for the counter keys preserves type checking while reducing repeated declarations"}}
{"run":409,"commit":"wip","metric":9410,"metrics":{"loc":9410,"vitest":107,"eslint_scoped":1},"status":"discard","description":"Tried grouped browser socket connection assertion, but wrapping increased LOC","timestamp":1777372139262,"segment":2,"confidence":12.166037735849057,"iterationTokens":1878,"asi":{"hypothesis":"Browser Deepgram socket URL/protocol assertions could be grouped into one toMatchObject array assertion","rollback_reason":"The stringContaining/object literal wrapped over multiple lines, increasing LOC from 9407 to 9410","next_action_hint":"Keep separate assertions when grouped matcher literals are long enough for Prettier to expand"}}
{"run":410,"commit":"b756552","metric":9405,"metrics":{"loc":9405,"vitest":107,"eslint_scoped":1},"status":"keep","description":"Grouped simple browser capture mock assertions","timestamp":1777372177852,"segment":2,"confidence":12.014897579143389,"iterationTokens":1476,"asi":{"hypothesis":"Some browser Deepgram tests assert a single field on the only recorder/socket; toMatchObject array assertions preserve length and field checks with fewer lines"}}
{"run":411,"commit":"ef95915","metric":9403,"metrics":{"loc":9403,"vitest":107,"eslint_scoped":1},"status":"keep","description":"Collapsed browser media stream cleanup helper","timestamp":1777372219857,"segment":2,"confidence":11.867647058823529,"iterationTokens":2756,"asi":{"hypothesis":"stopMediaStream is a pure one-expression track cleanup helper; expression-bodied constant preserves cleanup behavior while reducing wrapper boilerplate"}}
{"run":412,"commit":"b211db7","metric":9399,"metrics":{"loc":9399,"vitest":107,"eslint_scoped":1},"status":"keep","description":"Collapsed native Deepgram delegation helpers","timestamp":1777372254494,"segment":2,"confidence":11.817184643510055,"iterationTokens":1351,"asi":{"hypothesis":"Native Deepgram stop and startNativeCapture are pure delegations to pause/enqueue; expression-bodied fields preserve lifecycle behavior while reducing wrapper boilerplate"}}
